Expression,Reading,Meaning,Level,Frequency,Sentence,Translation,Episodes,Image
キャップマン,キャップ,"1. cap (hat)<br>2. cap (of a bottle, pen, etc.)",Unlabeled,3,≪次のビーフはMIYAと 謎の<b>キャップマン</b>だ！,≪The next beef is between MIYA and the mysterious cap man!,"#08 PART 宿命のトーナメント!.ja, #10 PART 言葉のいらないDAP.ja",
おはよう,おはよう,1. good morning,N2,3,≪<b>おはよう</b>　ランガくん！ おはよう,≪Good morning Ranga-kun! good morning,#08 PART 宿命のトーナメント!.ja,
関係,かんけい,"1. relation, relationship, connection<br>2. participation, involvement, concern<br>3. influence, effect<br>4. sexual relations, sexual relationship<br>5. related to, connected to",N4,3,俺には<b>関係</b>ね～けどな,It doesn't matter to me though,"#08 PART 宿命のトーナメント!.ja, #10 PART 言葉のいらないDAP.ja, #12 PART 俺たちの無限大!.ja",
皆,みんな,"1. everyone, everybody, all<br>2. everything, all",N4,3,《菊池：<b>皆</b>が 愛之介様を求めている,《Kikuchi: Everyone is looking for Ainosuke-sama.,"#08 PART 宿命のトーナメント!.ja, #09 PART あの時、俺たちは特別だった.ja, #11 PART キング VS ザコ.ja",
おかげ,おかげ,"1. grace (of God), benevolence (of Buddha), blessing<br>2. assistance, help, aid<br>3. effects, influence",N4,3,オーリーができるようになったのも 暦の<b>おかげ</b>だし,It's thanks to the calendar that I was able to do an ollie.,"#08 PART 宿命のトーナメント!.ja, #10 PART 言葉のいらないDAP.ja",
感じ,かんじ,"1. feeling, sense, impression",N3,3,一人ぼっちな<b>感じ</b>なんだ　アイツは,He feels like he's all alone.,"#08 PART 宿命のトーナメント!.ja, #09 PART あの時、俺たちは特別だった.ja, #10 PART 言葉のいらないDAP.ja",
勘,かん,"1. perception, intuition, the sixth sense",N3,3,その「<b>勘</b>」で入ったＬＡのレストランは 大外れだったけどな！,The LA restaurant I went to based on that ``gut feeling'' turned out to be a big mistake!,#08 PART 宿命のトーナメント!.ja,
人生,じんせい,1. (human) life (i.e. conception to death),N3,3,いいかげんにしろ　スケートなんかで <b>人生</b>を棒に振るつもりか,"Don't worry, are you planning on ruining your life by skating?","#08 PART 宿命のトーナメント!.ja, #11 PART キング VS ザコ.ja",
ドキドキ,ドキドキ,"1. thump-thump, bang-bang, pit-a-pat, pitapat, pitter-patter<br>2. to beat fast (of one's heart), to throb, to pound, to palpitate",Unlabeled,3,なのに…　<b>ドキドキ</b>しない,But... I'm not excited,"#08 PART 宿命のトーナメント!.ja, #09 PART あの時、俺たちは特別だった.ja, #10 PART 言葉のいらないDAP.ja",
壊れる,こわれる,"1. to be broken, to break<br>2. to fall through, to come to nothing",N4,3,<b>壊れ</b>たら直せばいいだろ,"If it's broken, you can fix it.","#08 PART 宿命のトーナメント!.ja, #11 PART キング VS ザコ.ja",
ブレイク,ブレイク,"1. break (rest)<br>2. break (tennis, boxing, snooker, etc.)<br>3. suddenly becoming popular, becoming a hit",Unlabeled,3,んっ！ ≪でた！　パワー<b>ブレイク</b>！,Huh! ≪It came out! Power break!,"#08 PART 宿命のトーナメント!.ja, #09 PART あの時、俺たちは特別だった.ja",
間違う,まちがう,"1. to make a mistake, to be incorrect, to be mistaken",N1,3,私は　愛之介様に <b>間違っ</b>た選択肢を与えてしまった,I gave Ainosuke-sama the wrong choice.,"#08 PART 宿命のトーナメント!.ja, #10 PART 言葉のいらないDAP.ja, #11 PART キング VS ザコ.ja",
進入,しんにゅう,"1. entry, approach, penetration",Unlabeled,3,<b>進入</b>角度も甘い,The approach angle is also poor,#09 PART あの時、俺たちは特別だった.ja,
勝ち目,かちめ,"1. chance (of success), odds",Unlabeled,3,同感だな で　ランガに<b>勝ち目</b>はあんのか？,"I agree. So, does Langa have any chance of winning?","#09 PART あの時、俺たちは特別だった.ja, #11 PART キング VS ザコ.ja, #12 PART 俺たちの無限大!.ja",
強引,ごういん,"1. overbearing, coercive, pushy, forcible, high-handed",N2,3,スケートも口説きも<b>強引</b>さが信条でね,My philosophy is to be forceful when it comes to skating and making advances.,#09 PART あの時、俺たちは特別だった.ja,
かわす,かわす,"1. to dodge, to evade, to avoid, to sidestep",Unlabeled,3,《桜屋敷：俺が<b>かわす</b>ことは 予想してたんだろ,《Sakurayashiki: You probably expected me to dodge.,#09 PART あの時、俺たちは特別だった.ja,
予想,よそう,"1. expectation, anticipation, prediction, forecast, conjecture",N1,3,君は僕の<b>予想</b>を 確実に超えてきてくれるね,You will definitely exceed my expectations.,"#09 PART あの時、俺たちは特別だった.ja, #11 PART キング VS ザコ.ja",
仕掛ける,しかける,"1. to start, to begin, to commence<br>2. to challenge, to pick (a fight), to make (war), to draw (a reaction) from<br>3. to set (traps), to plant (explosives), to lay (mines)<br>4. to make a meld call",N1,3,なに!? 愛抱夢が<b>仕掛ける</b>！,What!? Aiyumu sets it up!,#09 PART あの時、俺たちは特別だった.ja,
通り,とおり,"1. avenue, street, way, road<br>2. coming and going, street traffic<br>3. flow (of water, air, etc.)<br>4. transmission (of sound), reach (e.g. of voice)<br>5. fame, reputation, popularity<br>6. the same status or way, as (e.g. as expected, as I said)<br>7. understanding, comprehension<br>8. counter for sets of things, counter for methods, ways, types",N3,3,《桜屋敷：やはり思った<b>通り</b>だ,《Sakura Mansion: As expected.,"#09 PART あの時、俺たちは特別だった.ja, #11 PART キング VS ザコ.ja",
イヴ,イブ,"1. eve (esp. Christmas Eve), the night before",Unlabeled,3,僕らは　アダムと<b>イヴ</b>になるんだから,We become Adam and Eve,"#09 PART あの時、俺たちは特別だった.ja, #11 PART キング VS ザコ.ja, #12 PART 俺たちの無限大!.ja",
てめぇ,てめえ,"1. you<br>2. I, me, oneself, myself, yourself, himself, herself",Unlabeled,3,<b>てめぇ</b>のっ！,Oh my!,#10 PART 言葉のいらないDAP.ja,
アハハハッ,あはは,1. a-ha-ha (laughing loudly),Unlabeled,3,<b>アハハハッ</b>！,Ahahaha!,"#10 PART 言葉のいらないDAP.ja, #12 PART 俺たちの無限大!.ja",
感ずる,かんじる,"1. to feel, to sense, to experience",N2,3,<b>感じ</b>ないんだ　何も,I don't feel anything.,"#10 PART 言葉のいらないDAP.ja, #12 PART 俺たちの無限大!.ja",
障害,しょうがい,"1. obstacle, impediment, hindrance, difficulty, barrier<br>2. handicap, impairment, disability, disorder, malfunction",N3,3,んっ 愛に<b>障害</b>はつきものさ,"Hmm, love always comes with obstacles.","#10 PART 言葉のいらないDAP.ja, #11 PART キング VS ザコ.ja",
アッハハハハ,アッハハハハ,1. Ahahahaha (Auto-translated),Unlabeled,3,<b>アッハハハハ</b>！　ハハハッ！,Ahahahaha! Hahaha!,#11 PART キング VS ザコ.ja,
指名,しめい,"1. naming, nominating, designating<br>2. calling on, asking for, requesting",Unlabeled,3,愛抱夢はシャドウの代役に 君を<b>指名</b>した,Aidomu appointed you to replace Shadow.,#11 PART キング VS ザコ.ja,
ファン,ファン,"1. fan, enthusiast, lover (of)<br>2. fan (e.g. electric)",N1,3,雑誌のは大<b>ファン</b>とかのＦＡＮだよ,I'm a big fan of magazines.,#11 PART キング VS ザコ.ja,
求める,もとめる,"1. to want, to wish for<br>2. to request, to demand, to require, to ask for<br>3. to seek, to search for, to look for, to pursue (pleasure), to hunt (a job)<br>4. to purchase, to buy",N3,3,《菊池：皆が 愛之介様を<b>求め</b>ている,《Kikuchi: Everyone is looking for Ainosuke-sama.,"#11 PART キング VS ザコ.ja, #12 PART 俺たちの無限大!.ja",
捜査,そうさ,"1. search (esp. in criminal investigations), investigation, inquiry, enquiry",N1,3,ですが　松村警視 神道議員の<b>捜査</b>がまだ！,"However, Superintendent Matsumura, the Shinto lawmaker is still under investigation!","#11 PART キング VS ザコ.ja, #12 PART 俺たちの無限大!.ja",
テレビ,テレビ,"1. television, TV<br>2. TV program, TV programme, TV broadcast",N5,2,まだ　ヒーローの<b>テレビ</b>とか見てた頃さ,I was still watching heroes on TV.,"#01 PART 熱い夜に雪が降る.ja, #12 PART 俺たちの無限大!.ja",
モテる,もてる,"1. to be able to possess (hold, get, etc.)<br>2. to be well liked, to be popular, to be pampered (spoiled, doted upon, etc.), to be welcomed<br>3. to endure (the tests of time, the elements, etc.), to last<br>4. possessed, held<br>5. rich, wealthy, affluent",Unlabeled,2,焼いたほうが 女に<b>モテる</b>と思ってる,I think it's more popular with women if you bake it.,"#01 PART 熱い夜に雪が降る.ja, #06 PART 湯けむりミステリースケート？!.ja",
あぶ,あぶ,"1. horsefly, gadfly",Unlabeled,2,≪<b>あぶ</b>ね～だろ！,≪It's Abune~!,"#01 PART 熱い夜に雪が降る.ja, #07 PART つりあわねーんだよ.ja",
盛り上がる,もりあがる,"1. to swell, to rise, to bulge, to be piled up<br>2. to rouse, to get excited",N1,2,今日も<b>盛り上がっ</b>てんな～,It's so exciting today too!,"#01 PART 熱い夜に雪が降る.ja, #10 PART 言葉のいらないDAP.ja",
キャン,きゃん,"1. tomboy, bobby soxer, flapper",Unlabeled,2,落ち着いていけよ…　暦 <b>キャン</b>！,Calm down... Koyomi Can!,"#01 PART 熱い夜に雪が降る.ja, #05 PART 情熱のダンシングNight!.ja",
くそ,ばば,"1. shit, crap<br>2. pooh-pooh, poop, something dirty",Unlabeled,2,なっ！　<b>くそ</b>　なめやがって！,"What! Damn, you licked me!","#01 PART 熱い夜に雪が降る.ja, #10 PART 言葉のいらないDAP.ja",
なめる,なめる,"1. to lick, to lap, to suck<br>2. to taste<br>3. to experience (esp. a hardship)<br>4. to look down on (someone), to make fun of, to put down, to treat with contempt, to underestimate<br>5. to lick (at; of flames), to burn",Unlabeled,2,なっ！　くそ　<b>なめ</b>やがって！,"What! Damn, you licked me!","#01 PART 熱い夜に雪が降る.ja, #03 PART 望まない勇者.ja",
アンチ,アンチ,1. anti-<br>2. hater,Unlabeled,2,≪Ｓ界の<b>アンチ</b>ヒーロー！ シャー！,≪Antihero of the S world! Shah!,#01 PART 熱い夜に雪が降る.ja,
興味,きょうみ,"1. interest (in something), curiosity (about something), zest (for)",N4,2,君に対する<b>興味</b>が １ミリもないからね,Because I don't have even the slightest bit of interest in you.,"#01 PART 熱い夜に雪が降る.ja, #04 PART 愛のマタドール、愛抱夢.ja",
背,せい,"1. height, stature",N5,2,<b>背</b>たか～い,My back is tall,"#01 PART 熱い夜に雪が降る.ja, #02 PART はじめてのサイコー！.ja",
馳,馳,Hase,Unlabeled,2,<b>馳</b>河ランガです,This is Ranga Hasegawa.,#01 PART 熱い夜に雪が降る.ja,
河,かわ,"1. river, stream<br>2. River, the ... river",N5,2,馳<b>河</b>ランガです,This is Ranga Hasegawa.,#01 PART 熱い夜に雪が降る.ja,
せっかく,せっかく,"1. with trouble, at great pains<br>2. rare, valuable, precious, long-awaited<br>3. kind, generous<br>4. specially, especially, expressly",Unlabeled,2,<b>せっかく</b>来てもらったのに 申し訳ないが—,"I'm sorry you took the trouble to come, but-","#01 PART 熱い夜に雪が降る.ja, #10 PART 言葉のいらないDAP.ja",
未成年,みせいねん,"1. minor, not of age",Unlabeled,2,<b>未成年</b>は雇えないんだ,You can't hire minors.,"#01 PART 熱い夜に雪が降る.ja, #06 PART 湯けむりミステリースケート？!.ja",
止める,とめる,"1. to stop, to turn off<br>2. to park<br>3. to prevent, to suppress (a cough), to hold back (tears), to hold (one's breath), to relieve (pain)<br>4. to stop (someone from doing something), to dissuade, to forbid, to prohibit<br>5. to notice, to be aware of, to concentrate on, to pay attention to, to remember, to bear in mind<br>6. to fix (in place), to fasten, to tack, to pin, to nail, to button, to staple<br>7. to detain, to keep in custody",N4,2,お～い！　<b>止め</b>てくれ～！,Hey! Please stop!,"#01 PART 熱い夜に雪が降る.ja, #11 PART キング VS ザコ.ja",
スケートボード,スケートボード,"1. skateboard, skateboarding",Unlabeled,2,<b>スケートボード</b> 友達が教えてくれてさ,A friend of mine taught me how to skateboard.,"#01 PART 熱い夜に雪が降る.ja, #02 PART はじめてのサイコー！.ja",
ハハハハッ,ハハハハッ,1. Hahahaha (Auto-translated),Unlabeled,2,存分にコケろ！　<b>ハハハハッ</b>！,Get rid of it to your heart's content! Hahahaha!,"#01 PART 熱い夜に雪が降る.ja, #02 PART はじめてのサイコー！.ja",
ミリ,ミリ,"1. milli-, 10^-3<br>2. millimetre, millimeter",N2,2,１<b>ミリ</b>も進んでねえ～！,It hasn't advanced even one millimeter!,"#01 PART 熱い夜に雪が降る.ja, #04 PART 愛のマタドール、愛抱夢.ja",
こうる,こうる,"1. to pack, to box, to package",Unlabeled,2,走るみたいに蹴るんだよ <b>こうっ</b>！,Kick like you're running! Come on!,"#01 PART 熱い夜に雪が降る.ja, #02 PART はじめてのサイコー！.ja",
欲しい,ほしい,"1. wanted, wished for, in need of, desired<br>2. I want (you) to",N5,2,記者さんが　スケートを始めた頃の 写真も<b>欲しい</b>　って言うから,The reporter wanted a photo of me from when I first started skating.,"#01 PART 熱い夜に雪が降る.ja, #03 PART 望まない勇者.ja",
困る,こまる,"1. to be troubled, to have difficulty, to be in a fix, to be at a loss, to be stumped, to be embarrassed<br>2. to be bothered, to be inconvenienced, to be annoyed<br>3. to be badly off, to be hard up, to be in straitened circumstances",N5,2,俺も暦も行けなくて<b>困っ</b>ててさ,I'm in trouble because neither I nor Koyomi can go.,"#01 PART 熱い夜に雪が降る.ja, #10 PART 言葉のいらないDAP.ja",
客,きゃく,"1. guest, visitor<br>2. customer, client, shopper, spectator, audience, tourist, sightseer, passenger<br>3. counter for containers used to entertain guests",N4,2,バイトってのは　<b>客</b>のボードを ここに届けてほしいんだ,My part-time job wants me to deliver the customer's board here.,"#01 PART 熱い夜に雪が降る.ja, #02 PART はじめてのサイコー！.ja",
ほしい,ほしい,"1. wanted, wished for, in need of, desired<br>2. I want (you) to",Unlabeled,2,バイトってのは　客のボードを ここに届けて<b>ほしい</b>んだ,My part-time job wants me to deliver the customer's board here.,"#01 PART 熱い夜に雪が降る.ja, #06 PART 湯けむりミステリースケート？!.ja",
あさって,あさって,1. day after tomorrow,N5,2,明日も　<b>あさって</b>も ず～っと　ず～っと,"Tomorrow and the day after tomorrow, all the time","#01 PART 熱い夜に雪が降る.ja, #10 PART 言葉のいらないDAP.ja",
行う,おこなう,"1. to perform, to do, to conduct oneself, to carry out",N4,2,入札は規定どおりに<b>行わ</b>れた,The bidding was carried out as per the regulations.,"#01 PART 熱い夜に雪が降る.ja, #07 PART つりあわねーんだよ.ja",
普段,ふだん,"1. usual, normal, everyday, habitual, ordinary<br>2. usually, normally, generally, habitually, always",N3,2,<b>普段</b>　しゃべんね～くせに—,Even though I don't usually talk...,"#01 PART 熱い夜に雪が降る.ja, #10 PART 言葉のいらないDAP.ja",
ええっ,ええ,"1. yes, that is correct, right<br>2. um, errr<br>3. huh?<br>4. grrr, gah, Must I?<br>5. good",Unlabeled,2,<b>ええっ</b>　ちょっ！　あああ　あでっ！,"Yeah, hey! Aaah Ade!","#01 PART 熱い夜に雪が降る.ja, #02 PART はじめてのサイコー！.ja",
ヘヘッ,へへ,"1. heh-heh, hee-hee, ha ha<br>2. female genitals, vagina, vulva",Unlabeled,2,<b>ヘヘッ</b> あっ,Hehe ah,"#01 PART 熱い夜に雪が降る.ja, #02 PART はじめてのサイコー！.ja",
最低,さいてい,"1. least, lowest, minimum<br>2. worst<br>3. awful, horrible, nasty, disgusting<br>4. at the very least",N3,2,そういうウソは<b>最低</b>っスよ！店長のくせに！,That kind of lie is the worst! Even though you're the manager!,"#01 PART 熱い夜に雪が降る.ja, #10 PART 言葉のいらないDAP.ja",
でぇ,で,"1. coming out, going out, outflow, efflux, rising (of the Sun or the Moon)<br>2. attending (work), appearing (on stage), one's turn to go on<br>3. start, beginning<br>4. origins, background, person (or item) originating from ..., graduate of ..., native of ..., member of ... (lineage)<br>5. architectural member that projects outward<br>6. highest point of the stern of a ship<br>7. amount (comprising something), amount of time or effort required to do something",Unlabeled,2,いっ<b>でぇ</b>～！ よしよし,"Come on! Okay, okay","#01 PART 熱い夜に雪が降る.ja, #07 PART つりあわねーんだよ.ja",
口外無用,こうがい,"1. revealing (information, a secret, etc.), disclosure, telling, letting out",Unlabeled,2,「Ｓ」は<b>口外無用</b>の 極秘のレースだからな,"""S"" is a top secret race that should not be talked about.","#01 PART 熱い夜に雪が降る.ja, #03 PART 望まない勇者.ja",
極秘,ごくひ,1. absolute secrecy,Unlabeled,2,「Ｓ」は口外無用の <b>極秘</b>のレースだからな,"""S"" is a top secret race that should not be talked about.","#01 PART 熱い夜に雪が降る.ja, #03 PART 望まない勇者.ja",
驚く,おどろく,"1. to be surprised, to be astonished",N4,2,<b>驚か</b>せやがって》,Surprise me》,#01 PART 熱い夜に雪が降る.ja,
一気,いっき,"1. one breath<br>2. chug!, drink!",N1,2,<b>一気</b>にケリをつけてやる！,I'll settle things all at once!,"#01 PART 熱い夜に雪が降る.ja, #11 PART キング VS ザコ.ja",
時速,じそく,1. speed (per hour),N2,2,早いときは<b>時速</b>100キロを 超えることだってあるんだぜ,At times it can exceed 100km/h.,"#01 PART 熱い夜に雪が降る.ja, #10 PART 言葉のいらないDAP.ja",
そして,そして,"1. and, and then, thus, and now, and finally",N5,2,<b>そして</b>決闘するヤツは 必ず何か賭けなくちゃならない,And those who duel always have to bet something.,#01 PART 熱い夜に雪が降る.ja,
作れる,作れる,1. I can make it (Auto-translated),Unlabeled,2,えっ　自分で<b>作れる</b>もんなの？,"Eh, can you make it yourself?","#01 PART 熱い夜に雪が降る.ja, #02 PART はじめてのサイコー！.ja",
オムレツ,オムレツ,"1. omelette, omelet",Unlabeled,2,もちろん！ 息子の<b>オムレツ</b>が待ってるなんて—,Of course! My son's omelet is waiting...,#01 PART 熱い夜に雪が降る.ja,
よそ見,よそみ,"1. looking away, looking aside",Unlabeled,2,何だ？ <b>よそ見</b>すんな　前見ろ　前！,"What? Don't look away, look ahead!","#01 PART 熱い夜に雪が降る.ja, #10 PART 言葉のいらないDAP.ja",
感想,かんそう,"1. impressions, thoughts, feelings, reactions",N2,2,ど～だ？　初めての<b>感想</b>は,What is it? My first impressions are,"#01 PART 熱い夜に雪が降る.ja, #02 PART はじめてのサイコー！.ja",
待ちわびる,まちわびる,"1. to be tired of waiting, to wait impatiently",Unlabeled,2,<b>待ちわび</b>たぜ　俺のニューデッキ！,I've been waiting for it! My new deck!,"#01 PART 熱い夜に雪が降る.ja, #12 PART 俺たちの無限大!.ja",
調整,ちょうせい,"1. adjustment, regulation, coordination, reconciliation, tuning, fixing, tailoring",N2,2,わざわざ プロに<b>調整</b>を頼んだんだ,I went out of my way to have it adjusted by a professional.,"#01 PART 熱い夜に雪が降る.ja, #03 PART 望まない勇者.ja",
そのまま,そのまま,"1. without change, as is<br>2. just like, extremely similar<br>3. immediately, just after, without a pause",N3,2,<b>そのまま</b>首絞めていいなら,If you can just strangle me,"#01 PART 熱い夜に雪が降る.ja, #08 PART 宿命のトーナメント!.ja",
とても,とても,"1. very, awfully, exceedingly<br>2. (not) at all, by no means, simply (cannot)",N5,2,愛抱夢に勝つなんて<b>とても</b>…》,It's so great to win a love dream...》,"#01 PART 熱い夜に雪が降る.ja, #04 PART 愛のマタドール、愛抱夢.ja",
不能,ふのう,"1. impossible, incapable (of doing), unable (to do)<br>2. incompetence, inability<br>3. impotence<br>4. having no solution (of an equation)",Unlabeled,2,予測<b>不能</b>だな,It's unpredictable,"#01 PART 熱い夜に雪が降る.ja, #12 PART 俺たちの無限大!.ja",
ヘッ,ヘッドホン,"1. headphone, headphones<br>2. Headphones",Unlabeled,2,なに!? <b>ヘッ</b>,What!? Heh,"#01 PART 熱い夜に雪が降る.ja, #04 PART 愛のマタドール、愛抱夢.ja",
だいたい,だいたい,"1. outline, main points, gist, substance, essence<br>2. generally, on the whole, mostly, almost, nearly, approximately, roughly, about<br>3. general, rough<br>4. in the first place, first and foremost, from the start, to begin with",Unlabeled,2,<b>だいたい</b>お前はぁ～！,Most of you are!,#01 PART 熱い夜に雪が降る.ja,
逆,ぎゃく,"1. reverse, opposite<br>2. converse (of a hypothesis, etc.)<br>3. inverse (function)",N3,2,<b>逆</b>だよバカ　それじゃ 転んだとき大ケガするぞ!?,"It's the opposite, idiot. Then you'll get seriously injured when you fall!?","#01 PART 熱い夜に雪が降る.ja, #02 PART はじめてのサイコー！.ja",
たぶん,たぶん,"1. perhaps, probably<br>2. generous, many, much, great",N5,2,<b>たぶん</b> たぶんて　お前な…,Maybe it's you...,#01 PART 熱い夜に雪が降る.ja,
ド,ド,D (as in Dreadnought) / Super-,Unlabeled,2,暦は　ケガしてるだろ <b>ド</b>素人のお前よりはマシだ！,"Koyomi is injured, isn't she? It's better than you, an amateur!",#01 PART 熱い夜に雪が降る.ja,
骨折,こっせつ,1. bone fracture,N3,2,<b>骨折</b>とかじゃ済まね～ぞ！ 聞いてんのか!?,A broken bone is not enough! Are you listening!?,"#01 PART 熱い夜に雪が降る.ja, #02 PART はじめてのサイコー！.ja",
ちょいと,いっすん,"1. one sun (approx. 3.03 cm)<br>2. little bit (of time, distance, etc.)",Unlabeled,2,<b>ちょいと</b>コケれば たちまち大けがだ,"If you fall a little bit, you'll be seriously injured in no time.","#01 PART 熱い夜に雪が降る.ja, #08 PART 宿命のトーナメント!.ja",
警戒,けいかい,"1. vigilance, caution, alertness, precaution, being on guard",N1,2,《チェリーが言うから ちょいと<b>警戒</b>したが…》,"《Since Cherry said that, I was a little wary...》","#01 PART 熱い夜に雪が降る.ja, #06 PART 湯けむりミステリースケート？!.ja",
真面目,しんめんもく,"1. one's true character, one's true self, one's true worth<br>2. serious, earnest",N3,2,東大出のキャリア様は <b>真面目</b>だな,Careers from the University of Tokyo are serious.,"#01 PART 熱い夜に雪が降る.ja, #06 PART 湯けむりミステリースケート？!.ja",
先回り,さきまわり,"1. going on ahead, forestalling, anticipating, arrival before another",Unlabeled,2,<b>先回り</b>だ　おっさん！ 俺はまだ24だ！,"You're ahead of the curve, man! I'm only 24!","#01 PART 熱い夜に雪が降る.ja, #03 PART 望まない勇者.ja",
タイヤ,タイヤ,"1. tire, tyre",N1,2,車の<b>タイヤ</b>みたいに溝があるだろ,It has grooves like a car tire.,"#01 PART 熱い夜に雪が降る.ja, #11 PART キング VS ザコ.ja",
体重,たいじゅう,1. (body) weight,Unlabeled,2,でも　<b>体重</b>のかけ方を直せば もっとよくなる,"But if you change the way you put your weight on it, things will get better.","#01 PART 熱い夜に雪が降る.ja, #03 PART 望まない勇者.ja",
位置,いち,"1. place, situation, position, location",N3,2,そして あの<b>位置</b>で足を固定したこと…,And the fact that I fixed my feet in that position...,"#01 PART 熱い夜に雪が降る.ja, #03 PART 望まない勇者.ja",
固定,こてい,"1. fixing (in place), being fixed (in place), securing, anchoring, fastening down<br>2. fixing (e.g. salary, capital), keeping the same<br>3. fixation (histology)<br>4. user name (on an online forum like 2ch where the majority of users post anonymously)<br>5. user of an online handle (instead of posting anonymously)",N1,2,そして あの位置で足を<b>固定</b>したこと…,And the fact that I fixed my feet in that position...,"#01 PART 熱い夜に雪が降る.ja, #02 PART はじめてのサイコー！.ja",
