Expression,Reading,Meaning,Level,Frequency,Sentence,Translation,Episodes,Image
ふっ,フッ,"1. hah (derisively), pooh<br>2. pfft (of something disappearing), poof<br>3. huff, puff",Unlabeled,5,<b>ふっ</b>！ どうだぁ！,Huh! What do you think?,"#03 PART 望まない勇者.ja, #06 PART 湯けむりミステリースケート？!.ja, #09 PART あの時、俺たちは特別だった.ja",
つう,つう,"1. authority, expert, connoisseur, well-informed person<br>2. counter for messages, letters, notes, documents, etc.<br>3. understanding (esp. of male-female relations), tact, insight<br>4. supernatural powers, magical powers",Unlabeled,5,いつもか おい！　今なん<b>つっ</b>た!?,Always? Hey! What did you just do!?,"#03 PART 望まない勇者.ja, #05 PART 情熱のダンシングNight!.ja, #10 PART 言葉のいらないDAP.ja, #11 PART キング VS ザコ.ja",
才能,さいのう,"1. talent, ability",N3,5,<b>才能</b>のないヤツは 引っ込んでなよ～,"If you don't have talent, stay away.","#03 PART 望まない勇者.ja, #07 PART つりあわねーんだよ.ja, #08 PART 宿命のトーナメント!.ja, #10 PART 言葉のいらないDAP.ja",
意味,いみ,"1. meaning, significance, sense",N5,5,そういう<b>意味</b>でも もっといろいろな選手と—,"In that sense, I would like to work with many different players...","#03 PART 望まない勇者.ja, #04 PART 愛のマタドール、愛抱夢.ja, #06 PART 湯けむりミステリースケート？!.ja, #08 PART 宿命のトーナメント!.ja, #11 PART キング VS ザコ.ja",
応援,おうえん,"1. aid, assistance, help, support, reinforcement<br>2. cheering, rooting (for), support",N2,5,すごい選手の<b>応援</b>ができるって 幸せなことなんですよ,It's a blessing to be able to support such great athletes.,"#03 PART 望まない勇者.ja, #08 PART 宿命のトーナメント!.ja, #09 PART あの時、俺たちは特別だった.ja, #11 PART キング VS ザコ.ja",
大事,だいじ,"1. important, serious, crucial<br>2. valuable, precious<br>3. serious matter, major incident, matter of grave concern, crisis<br>4. great undertaking, great enterprise, great thing<br>5. safe, OK",N4,5,自分を<b>大事</b>にするのは悪いことじゃない,It's not bad to take care of yourself,"#03 PART 望まない勇者.ja, #06 PART 湯けむりミステリースケート？!.ja, #08 PART 宿命のトーナメント!.ja, #10 PART 言葉のいらないDAP.ja, #11 PART キング VS ザコ.ja",
期待,きたい,"1. expectation, anticipation, hope<br>2. promising, rising, up-and-coming",N3,5,君なら ついてこれると<b>期待</b>していたよ,I was hoping that you would be able to follow me.,"#03 PART 望まない勇者.ja, #08 PART 宿命のトーナメント!.ja, #11 PART キング VS ザコ.ja, #12 PART 俺たちの無限大!.ja",
ひょっと,ひょっと,"1. possibly, perhaps, perchance<br>2. unintentionally, accidentally",N1,5,こいつは　<b>ひょっと</b>するかもよ？,Maybe this guy will?,"#03 PART 望まない勇者.ja, #04 PART 愛のマタドール、愛抱夢.ja, #05 PART 情熱のダンシングNight!.ja, #06 PART 湯けむりミステリースケート？!.ja",
使える,つかう,"1. to use (a thing, method, etc.), to make use of, to put to use<br>2. to use (a person, animal, puppet, etc.), to employ, to handle, to manage, to manipulate<br>3. to use (time, money, etc.), to spend, to consume<br>4. to use (language), to speak",Unlabeled,5,あのトリックは直線でしか<b>使え</b>ない,That trick can only be used in a straight line.,"#03 PART 望まない勇者.ja, #05 PART 情熱のダンシングNight!.ja, #11 PART キング VS ザコ.ja",
ネバネバ,ねばねば,"1. sticky, gluey, gummy, glutinous, viscous, gooey, greasy<br>2. stickiness, something sticky",Unlabeled,5,<b>ネバネバ</b>ネバネバ～！ 離れろよ～！,Sticky sticky! Get away!,#03 PART 望まない勇者.ja,
すばらしい,すばらしい,"1. wonderful, splendid, magnificent",N4,5,君は本当に<b>すばらしい</b>ね,you are really amazing,"#03 PART 望まない勇者.ja, #04 PART 愛のマタドール、愛抱夢.ja, #06 PART 湯けむりミステリースケート？!.ja, #09 PART あの時、俺たちは特別だった.ja, #12 PART 俺たちの無限大!.ja",
危険,きけん,"1. danger, peril, hazard<br>2. risk",N4,5,だが <b>危険</b>なスケーターってことは確かだ,But he's definitely a dangerous skater.,"#04 PART 愛のマタドール、愛抱夢.ja, #09 PART あの時、俺たちは特別だった.ja, #10 PART 言葉のいらないDAP.ja, #12 PART 俺たちの無限大!.ja",
足りる,たりる,"1. to be sufficient, to be enough<br>2. to be worth doing, to be worthy of, to deserve<br>3. to do (the job), to serve, to answer",N4,5,これでも<b>足り</b>ないくらいさ んっ？,Isn't this enough?,"#04 PART 愛のマタドール、愛抱夢.ja, #07 PART つりあわねーんだよ.ja, #11 PART キング VS ザコ.ja",
帰る,かえる,"1. to return, to come home, to go home, to go back<br>2. to leave<br>3. to get home, to get to home plate",N5,5,いつも晩ごはんまでには <b>帰っ</b>てくる子なんだけどねぇ,He always comes home by dinner time.,"#04 PART 愛のマタドール、愛抱夢.ja, #07 PART つりあわねーんだよ.ja, #10 PART 言葉のいらないDAP.ja",
ふさわしい,ふさわしい,"1. appropriate, adequate, suitable, fitting, worthy",Unlabeled,5,今夜は　ここが<b>ふさわしい</b>と,I think this is the right place tonight,"#04 PART 愛のマタドール、愛抱夢.ja, #11 PART キング VS ザコ.ja, #12 PART 俺たちの無限大!.ja",
かっ,かっ,Kaッ,Unlabeled,5,知る<b>かっ</b>！,Do you know!,"#04 PART 愛のマタドール、愛抱夢.ja, #06 PART 湯けむりミステリースケート？!.ja, #09 PART あの時、俺たちは特別だった.ja, #11 PART キング VS ザコ.ja",
会う,あう,"1. to meet, to encounter, to see<br>2. to have an accident, to have a bad experience",N5,5,僕は　また必ず君に<b>会う</b>よ,I'll definitely meet you again,"#04 PART 愛のマタドール、愛抱夢.ja, #05 PART 情熱のダンシングNight!.ja, #10 PART 言葉のいらないDAP.ja",
程度,ていど,"1. degree, amount, grade, standard, of the order of (following a number), about, approximately",N3,5,彼ら<b>程度</b>じゃ 君の相手にはならないね,They're no match for you.,"#04 PART 愛のマタドール、愛抱夢.ja, #08 PART 宿命のトーナメント!.ja, #10 PART 言葉のいらないDAP.ja, #11 PART キング VS ザコ.ja",
いただく,いただく,"1. to receive, to get, to accept, to take, to buy<br>2. to eat, to drink<br>3. to be crowned with, to wear (on one's head), to have (on top)<br>4. to have (as one's leader), to live under (a ruler), to install (a president)<br>5. to get somebody to do something",N4,5,私が勝ったら　愛之介様には スケートをやめて<b>いただき</b>ます,"If I win, Ainosuke-sama will be asked to stop skating.","#04 PART 愛のマタドール、愛抱夢.ja, #06 PART 湯けむりミステリースケート？!.ja, #08 PART 宿命のトーナメント!.ja, #12 PART 俺たちの無限大!.ja",
アレ,あれ,"1. that, that thing<br>2. that person<br>3. then, that time",Unlabeled,5,なんだ<b>アレ</b>!? ≪さすがスノー！,What is that!? ≪As expected of Snow!,"#04 PART 愛のマタドール、愛抱夢.ja, #07 PART つりあわねーんだよ.ja, #09 PART あの時、俺たちは特別だった.ja",
しれる,しれる,"1. to become known, to come to light, to be discovered<br>2. to be known, to be understood<br>3. to obviously not amount to much, to seem trivial<br>4. to be evident, to be obvious, to go without saying<br>5. to be very intense (worry, hope, etc.), to be extremely severe",Unlabeled,5,でも ちょっと束縛してしまうかも <b>しれ</b>ないけど大丈夫かな？,"But it might be a little restrictive, but is it okay?","#04 PART 愛のマタドール、愛抱夢.ja, #05 PART 情熱のダンシングNight!.ja, #08 PART 宿命のトーナメント!.ja, #09 PART あの時、俺たちは特別だった.ja, #10 PART 言葉のいらないDAP.ja",
なあ,なあ,Hey / I wonder (sentence ending particle),Unlabeled,5,<b>なあ</b> 嫌だ まだなんも言ってね～だろ,"Hey, I don't like it. Don't say anything yet.","#05 PART 情熱のダンシングNight!.ja, #07 PART つりあわねーんだよ.ja, #10 PART 言葉のいらないDAP.ja, #11 PART キング VS ザコ.ja, #12 PART 俺たちの無限大!.ja",
簡単,かんたん,"1. simple, easy, uncomplicated<br>2. brief, quick, light",N4,5,だが　実際にはそう<b>簡単</b>じゃない,But it's actually not that easy,"#05 PART 情熱のダンシングNight!.ja, #09 PART あの時、俺たちは特別だった.ja, #11 PART キング VS ザコ.ja",
体,からだ,"1. body<br>2. torso, trunk<br>3. build, physique, frame, figure<br>4. health, constitution<br>5. corpse, dead body",N5,5,どんな状況でも腰が引かず <b>体</b>が縮こまらない,"No matter what the situation, your hips won't tighten and your body won't shrink.","#05 PART 情熱のダンシングNight!.ja, #07 PART つりあわねーんだよ.ja, #09 PART あの時、俺たちは特別だった.ja, #10 PART 言葉のいらないDAP.ja",
大人,おとな,"1. adult, grown-up",N5,5,誰が哀れだ！ そこの<b>大人</b>２人！,Who is pathetic! Two adults there!,"#05 PART 情熱のダンシングNight!.ja, #06 PART 湯けむりミステリースケート？!.ja, #11 PART キング VS ザコ.ja",
外す,はずす,"1. to remove, to take off, to detach, to unfasten, to undo<br>2. to drop (e.g. from a team), to remove (from a position), to exclude, to expel<br>3. to leave (e.g. one's seat), to go away from, to step out, to slip away<br>4. to dodge (a question, blow, etc.), to evade, to sidestep, to avoid (e.g. peak season)<br>5. to miss (a target, chance, punch, etc.)",N3,5,ここは巡回から <b>外さ</b>せたはずですが,I should have removed him from patrol here.,"#05 PART 情熱のダンシングNight!.ja, #06 PART 湯けむりミステリースケート？!.ja, #07 PART つりあわねーんだよ.ja, #11 PART キング VS ザコ.ja, #12 PART 俺たちの無限大!.ja",
温泉,おんせん,"1. hot spring<br>2. onsen, hot spring resort, hot spring spa",N2,5,でもMIYAが ケガにすげぇ効く<b>温泉</b>があるって—,But MIYA says there's a hot spring that's amazingly effective for injuries.,#06 PART 湯けむりミステリースケート？!.ja,
以外,いがい,"1. with the exception of, excepting",N4,5,たまには　仕事<b>以外</b>で ここに来るのを勧めるよ,I recommend coming here once in a while for something other than work.,"#06 PART 湯けむりミステリースケート？!.ja, #08 PART 宿命のトーナメント!.ja, #12 PART 俺たちの無限大!.ja",
ルート,ルート,"1. route, path<br>2. channel (e.g. sales, distribution)",Unlabeled,5,カーラ　最も高低差の少ない<b>ルート</b>を,Carla: The route with the least difference in elevation,"#06 PART 湯けむりミステリースケート？!.ja, #07 PART つりあわねーんだよ.ja, #09 PART あの時、俺たちは特別だった.ja",
忠,忠,Tadashi,Unlabeled,5,答えろ！　<b>忠</b>っ！,Answer! Tadashi!,"#06 PART 湯けむりミステリースケート？!.ja, #07 PART つりあわねーんだよ.ja, #08 PART 宿命のトーナメント!.ja, #11 PART キング VS ザコ.ja",
ワクワク,わくわく,"1. trembling, getting nervous, excited, thrilled",Unlabeled,5,<b>ワクワク</b>するような ニュースを持ってきたよ,I've brought you some exciting news.,"#07 PART つりあわねーんだよ.ja, #08 PART 宿命のトーナメント!.ja",
二人,ふたり,"1. two persons, two people, pair, couple",N5,5,さぁ　行こう　<b>二人</b>の世界へ！,Let's go to our world!,"#08 PART 宿命のトーナメント!.ja, #12 PART 俺たちの無限大!.ja",
秒,びょう,1. second (unit of time)<br>2. arc second,N3,5,今のも25度で入れば 0.3<b>秒</b>早く抜けられた,"If I entered at 25 degrees, I could exit 0.3 seconds faster.","#08 PART 宿命のトーナメント!.ja, #09 PART あの時、俺たちは特別だった.ja",
一人ぼっち,ひとりぼっち,"1. aloneness, loneliness, solitude",Unlabeled,5,でもな 俺たちは<b>一人ぼっち</b>じゃない,But we're not alone,"#08 PART 宿命のトーナメント!.ja, #09 PART あの時、俺たちは特別だった.ja, #12 PART 俺たちの無限大!.ja",
ゾーン,ゾーン,1. zone,Unlabeled,5,<b>ゾーン</b>の影響だ Ｓでゾーンに入るなんて自殺行為だ,It's the influence of the zone. Entering the zone with S is suicidal.,#12 PART 俺たちの無限大!.ja,
イヤ,いや,"1. disagreeable, detestable, unpleasant, reluctant",Unlabeled,4,<b>イヤ</b>！　絶対勝つ！,I don’t like it! Definitely win!,"#01 PART 熱い夜に雪が降る.ja, #03 PART 望まない勇者.ja, #09 PART あの時、俺たちは特別だった.ja, #10 PART 言葉のいらないDAP.ja",
ったく,まったく,"1. really, truly, entirely, completely, wholly, perfectly<br>2. indeed<br>3. good grief",Unlabeled,4,<b>ったく</b>　あぶね～だろ,It's so oily,"#01 PART 熱い夜に雪が降る.ja, #02 PART はじめてのサイコー！.ja, #06 PART 湯けむりミステリースケート？!.ja, #12 PART 俺たちの無限大!.ja",
問題,もんだい,"1. question (e.g. on a test), problem<br>2. problem (e.g. societal, political), question, issue, subject (e.g. of research), case, matter<br>3. question (i.e. doubt)<br>4. public discussion, controversy<br>5. trouble, problem, inconvenience, difficulty",N5,4,準備は？ <b>問題</b>ない こっちもだ,"Are you ready? No problem, here too.","#01 PART 熱い夜に雪が降る.ja, #08 PART 宿命のトーナメント!.ja, #09 PART あの時、俺たちは特別だった.ja",
かわいい,かわいい,"1. cute, adorable, charming, lovely, pretty<br>2. dear, precious, darling, pet<br>3. innocent, childlike, childish, lovable<br>4. dainty, cute little, tiny",N5,4,はぁ～い！　今日は<b>かわいい</b>のが 入ってるんですよぉ！,Yes! I've got something cute today!,"#01 PART 熱い夜に雪が降る.ja, #02 PART はじめてのサイコー！.ja, #06 PART 湯けむりミステリースケート？!.ja",
やれる,やれる,1. I can do it (Auto-translated),Unlabeled,4,友達が勝ったってのに 喜んで<b>やれ</b>ねえ,I can't be happy even though my friend won.,"#01 PART 熱い夜に雪が降る.ja, #04 PART 愛のマタドール、愛抱夢.ja, #07 PART つりあわねーんだよ.ja, #09 PART あの時、俺たちは特別だった.ja",
いらっしゃる,いらっしゃる,"1. to come, to go, to be (somewhere)<br>2. to be (doing)",N4,4,<b>いらっしゃい</b>　暦の母です～,"Welcome, I'm Koyomi's mother~","#01 PART 熱い夜に雪が降る.ja, #02 PART はじめてのサイコー！.ja, #05 PART 情熱のダンシングNight!.ja, #11 PART キング VS ザコ.ja",
初心者,しょしんしゃ,1. beginner,Unlabeled,4,どうだ <b>初心者</b>に　ここはキツイだろ？,"What do you think? It's tough here for beginners, right?","#01 PART 熱い夜に雪が降る.ja, #02 PART はじめてのサイコー！.ja",
開く,ひらく,"1. to open, to undo, to unseal, to unpack<br>2. to bloom, to unfold, to spread out<br>3. to open (for business, e.g. in the morning)<br>4. to be wide (gap, etc.), to widen<br>5. to hold (meeting, party, etc.), to give, to open<br>6. to found (nation, dynasty, sect, etc.), to open (a new business), to set up, to establish, to start<br>7. to open (ports, borders, etc.)<br>8. to open (an account)<br>9. to open up (new land, path, etc.), to clear, to develop<br>10. to open (a file, etc.)<br>11. to extract (root), to reduce (equation)<br>12. to cut open (fish)<br>13. to change (kanji into hiragana)<br>14. to flare (e.g. skirt)<br>15. to slacken (into a poor posture)",N5,4,極限の先に世界は<b>開く</b>,The world opens beyond the limit,"#01 PART 熱い夜に雪が降る.ja, #02 PART はじめてのサイコー！.ja, #08 PART 宿命のトーナメント!.ja, #12 PART 俺たちの無限大!.ja",
レース,レース,1. race,N1,4,スケートの<b>レース</b>があるんだよ,There's a skating race,#01 PART 熱い夜に雪が降る.ja,
名,な,"1. name, given name<br>2. title<br>3. fame, renown, reputation<br>4. pretext, pretense, justification, appearance",N3,4,愛之介さん　今日も神道家の<b>名</b>を—,"Mr. Ainosuke, today also the name of a Shintoist.","#01 PART 熱い夜に雪が降る.ja, #03 PART 望まない勇者.ja, #04 PART 愛のマタドール、愛抱夢.ja, #05 PART 情熱のダンシングNight!.ja",
素人,しろうと,"1. amateur, layman, ordinary person, novice<br>2. respectable woman (i.e. not a prostitute, hostess, geisha)<br>3. unlicensed prostitute",N2,4,<b>素人</b>であれ　なんであれ ここでボードに乗ったからには—,"It doesn't matter if you're an amateur or whatever, now that you've ridden the board here...",#01 PART 熱い夜に雪が降る.ja,
ってぇ,って,"1. you said, he said, she said, they said<br>2. if ... then<br>3. do you seriously think that<br>4. I already told you, you should know by now that, of course<br>5. the said ..., said ...<br>6. says that ...<br>7. I hear that ...<br>8. as for the term ...<br>9. as for ...",Unlabeled,4,俺たちは　お前の前から ぜ<b>ってぇ</b>にいなくならねえ,We have to disappear before you,"#01 PART 熱い夜に雪が降る.ja, #03 PART 望まない勇者.ja, #05 PART 情熱のダンシングNight!.ja, #06 PART 湯けむりミステリースケート？!.ja",
一番,いちばん,"1. number one, first, first place<br>2. best, most<br>3. game, round, bout<br>4. as a test, as an experiment, by way of experiment, by way of trial, tentatively<br>5. song (e.g. in noh), piece",N3,4,自分の気持ちに素直になるのが <b>一番</b>だと思うな,I think it's best to be honest with your feelings.,"#01 PART 熱い夜に雪が降る.ja, #07 PART つりあわねーんだよ.ja, #08 PART 宿命のトーナメント!.ja, #10 PART 言葉のいらないDAP.ja",
キロ,キロ,"1. kilo-, 1000<br>2. kilogram, kilogramme<br>3. kilometre, kilometer<br>4. kilo-, 1024, 2^10",N5,4,早いときは時速100<b>キロ</b>を 超えることだってあるんだぜ,At times it can exceed 100km/h.,"#01 PART 熱い夜に雪が降る.ja, #06 PART 湯けむりミステリースケート？!.ja, #10 PART 言葉のいらないDAP.ja",
超える,こえる,"1. to cross over, to cross, to pass through, to pass over (out of), to go beyond, to go past<br>2. to exceed, to surpass, to be more (than)",N2,4,早いときは時速100キロを <b>超える</b>ことだってあるんだぜ,At times it can exceed 100km/h.,"#01 PART 熱い夜に雪が降る.ja, #08 PART 宿命のトーナメント!.ja, #09 PART あの時、俺たちは特別だった.ja, #10 PART 言葉のいらないDAP.ja",
勝ち,かち,"1. win, victory",N3,4,とにかく先にゴールしたヤツが<b>勝ち</b>だ！,"In any case, the first person to reach the goal wins!","#01 PART 熱い夜に雪が降る.ja, #08 PART 宿命のトーナメント!.ja, #09 PART あの時、俺たちは特別だった.ja, #12 PART 俺たちの無限大!.ja",
金,金,Kin,N3,4,<b>金</b>がもらえるわけでも—,Even if you don't get paid...,"#01 PART 熱い夜に雪が降る.ja, #03 PART 望まない勇者.ja, #08 PART 宿命のトーナメント!.ja, #11 PART キング VS ザコ.ja",
弁当,べんとう,"1. bento, Japanese box lunch",N3,4,母さ～ん　どこ？　<b>弁当</b>！,"Mother, where are you? Lunch box!","#01 PART 熱い夜に雪が降る.ja, #07 PART つりあわねーんだよ.ja",
おかえり,おかえり,1. return<br>2. welcome home,Unlabeled,4,<b>おかえり</b>　オムレツでよかった？,Welcome back. Was the omelet okay?,"#01 PART 熱い夜に雪が降る.ja, #04 PART 愛のマタドール、愛抱夢.ja, #05 PART 情熱のダンシングNight!.ja, #10 PART 言葉のいらないDAP.ja",
もちろん,もちろん,"1. of course, certainly, naturally",N4,4,<b>もちろん</b> ガムテで足をグルグル巻きにして滑った,"Of course, I slipped with my feet wrapped around the gumte.","#01 PART 熱い夜に雪が降る.ja, #04 PART 愛のマタドール、愛抱夢.ja, #07 PART つりあわねーんだよ.ja, #12 PART 俺たちの無限大!.ja",
あぁ,ああ,"1. ah!, oh!, alas!<br>2. yes, indeed, that is correct<br>3. aah, gah, argh<br>4. hey!, yo!<br>5. uh huh, yeah yeah, right, gotcha",Unlabeled,4,ぐ<b>あぁ</b>ああっ！,Guaaaaaaaaaaaaaaa!,"#01 PART 熱い夜に雪が降る.ja, #02 PART はじめてのサイコー！.ja, #08 PART 宿命のトーナメント!.ja, #11 PART キング VS ザコ.ja",
かまう,かまう,"1. to mind, to care about, to be concerned about, to have a regard for<br>2. to be an issue, to matter, to create inconvenience<br>3. to keep company, to care for, to look after, to entertain, to pay attention to, to spend time with<br>4. to interfere with, to meddle in<br>5. to tease<br>6. to banish, to prohibit",N4,4,俺は どっちでも<b>かまわ</b>ないぜ,I don't care either way.,"#01 PART 熱い夜に雪が降る.ja, #09 PART あの時、俺たちは特別だった.ja, #11 PART キング VS ザコ.ja",
おもしろい,おもしろい,"1. interesting, fascinating, intriguing, enthralling<br>2. amusing, funny, comical<br>3. enjoyable, fun, entertaining, pleasant, agreeable<br>4. good, satisfactory, favourable, desirable, encouraging",N5,4,そんなことをしても <b>おもしろく</b>ないからな,It's not fun to do that.,"#01 PART 熱い夜に雪が降る.ja, #03 PART 望まない勇者.ja, #05 PART 情熱のダンシングNight!.ja, #06 PART 湯けむりミステリースケート？!.ja",
おおっ,おお,"1. large, big, great, major, important, serious, heavy, loud<br>2. older, senior<br>3. final, ultimate<br>4. rough, broad, general",Unlabeled,4,≪<b>おおっ</b>　伝説降臨！,"≪Oh, the legend has arrived!","#01 PART 熱い夜に雪が降る.ja, #03 PART 望まない勇者.ja, #11 PART キング VS ザコ.ja",
手,て,"1. hand, arm<br>2. forepaw, foreleg<br>3. handle<br>4. hand, worker, help<br>5. trouble, care, effort<br>6. means, way, trick, move, technique, workmanship<br>7. hand, handwriting<br>8. kind, type, sort<br>9. one's hands, one's possession<br>10. ability to cope<br>11. hand (of cards)<br>12. direction<br>13. move (in go, shogi, etc.)",N5,4,あのトリックは　<b>手</b>だけで 回すとうまく回らないから—,That trick won't work if you do it with just your hands.,"#01 PART 熱い夜に雪が降る.ja, #02 PART はじめてのサイコー！.ja, #06 PART 湯けむりミステリースケート？!.ja, #12 PART 俺たちの無限大!.ja",
こりゃ,これ,"1. this, this one<br>2. this person<br>3. now, this point (in time)<br>4. here<br>5. used to stress the subject of a sentence<br>6. I, me",Unlabeled,4,≪<b>こりゃ</b>追いつくぞ！,≪Let's catch up!,"#01 PART 熱い夜に雪が降る.ja, #03 PART 望まない勇者.ja, #08 PART 宿命のトーナメント!.ja",
そっ,そう,"1. appearing that, seeming that, looking like, having the appearance of",Unlabeled,4,<b>そっ</b>か 次は後ろ足をデッキに乗せる,"I see, next step is to put your hind legs on the deck.","#01 PART 熱い夜に雪が降る.ja, #02 PART はじめてのサイコー！.ja, #04 PART 愛のマタドール、愛抱夢.ja",
最後,さいご,"1. end, conclusion<br>2. last, final, latest, most recent<br>3. no sooner than, once, right after (often having negative consequences)<br>4. one's final moments",N4,4,真打ちは<b>最後</b>に登場ってな！,Shinuchi appears at the end!,"#02 PART はじめてのサイコー！.ja, #03 PART 望まない勇者.ja, #08 PART 宿命のトーナメント!.ja",
側,そば,"1. near, close, beside, vicinity, proximity, besides, while<br>2. third person",N3,4,何だアリャ!? 《暦：イン<b>側</b>のでっぱりを利用した—,"What is it, Alya!? [Calendar: I used the protrusion on the inside]","#02 PART はじめてのサイコー！.ja, #03 PART 望まない勇者.ja, #04 PART 愛のマタドール、愛抱夢.ja, #06 PART 湯けむりミステリースケート？!.ja",
腰,こし,"1. lower back, waist, hips, lumbar region<br>2. body (of hair, noodle, paper, etc.), resilience, spring",N3,4,もっと<b>腰</b>落として！,Slow down more!,"#02 PART はじめてのサイコー！.ja, #03 PART 望まない勇者.ja, #07 PART つりあわねーんだよ.ja",
後ろ,うしろ,"1. back, behind, rear",N5,4,≪チェリーブロッサムが来るぞ～！ ≪すぐ<b>後ろ</b>にジョーだ！,≪Cherry Blossom is coming! ≪Joe is right behind you!,"#02 PART はじめてのサイコー！.ja, #03 PART 望まない勇者.ja, #04 PART 愛のマタドール、愛抱夢.ja",
