Expression,Reading,Meaning,Level,Frequency,Sentence,Translation,Episodes,Image
遅い,おそい,"1. slow, time-consuming, sluggish<br>2. late (in the day), towards the end (of the day or night), until a time far into the day or night<br>3. later (than expected or usual), late, behind schedule, behind time, tardy, overdue, unpunctual<br>4. too late, having missed the boat<br>5. dull, stupid",N5,12,《今頃？ いくら何でも<b>遅</b>すぎるだろ,《About this time? It's too late no matter what,"#01 PART 熱い夜に雪が降る.ja, #03 PART 望まない勇者.ja, #04 PART 愛のマタドール、愛抱夢.ja, #05 PART 情熱のダンシングNight!.ja, #06 PART 湯けむりミステリースケート？!.ja, #10 PART 言葉のいらないDAP.ja, #11 PART キング VS ザコ.ja",
初めて,はじめて,"1. for the first time<br>2. only after ... is it ..., only when ... do you ...",N5,12,ああ　<b>初めて</b>のヤツは それがないと入れない,"Ah, first-timers can't enter without it.","#01 PART 熱い夜に雪が降る.ja, #02 PART はじめてのサイコー！.ja, #08 PART 宿命のトーナメント!.ja, #10 PART 言葉のいらないDAP.ja, #11 PART キング VS ザコ.ja, #12 PART 俺たちの無限大!.ja",
あと,あと,"1. behind, rear<br>2. after, later<br>3. remainder, the rest<br>4. more (e.g. five more minutes), left<br>5. also, in addition<br>6. descendant, successor, heir<br>7. after one's death<br>8. past, previous",N3,12,<b>あと</b>がないぜ～！,There's nothing left!,"#01 PART 熱い夜に雪が降る.ja, #05 PART 情熱のダンシングNight!.ja, #06 PART 湯けむりミステリースケート？!.ja, #09 PART あの時、俺たちは特別だった.ja, #11 PART キング VS ザコ.ja, #12 PART 俺たちの無限大!.ja",
なんか,なんか,"1. something like ..., things like ..., someone like ..., the likes of ...",N1,12,いいかげんにしろ　スケート<b>なんか</b>で 人生を棒に振るつもりか,"Don't worry, are you planning on ruining your life by skating?","#01 PART 熱い夜に雪が降る.ja, #03 PART 望まない勇者.ja, #04 PART 愛のマタドール、愛抱夢.ja, #07 PART つりあわねーんだよ.ja, #10 PART 言葉のいらないDAP.ja, #11 PART キング VS ザコ.ja, #12 PART 俺たちの無限大!.ja",
スノーボード,スノーボード,"1. snowboard, snowboarding",Unlabeled,12,<b>スノーボード</b>ってさ　前でも横でも 滑るときの摩擦は一緒だろ？,"When it comes to snowboarding, the friction is the same whether you slide forward or sideways, right?","#01 PART 熱い夜に雪が降る.ja, #02 PART はじめてのサイコー！.ja, #03 PART 望まない勇者.ja, #05 PART 情熱のダンシングNight!.ja, #07 PART つりあわねーんだよ.ja, #10 PART 言葉のいらないDAP.ja",
子,こ,"1. child<br>2. young (animal)<br>3. young woman, young geisha<br>4. offshoot<br>5. interest<br>6. new shares<br>7. player who is not a dealer (in cards, mahjong, etc.)<br>8. bird egg<br>9. -er (often of young women)",N4,12,いつも晩ごはんまでには 帰ってくる<b>子</b>なんだけどねぇ,He always comes home by dinner time.,"#01 PART 熱い夜に雪が降る.ja, #02 PART はじめてのサイコー！.ja, #05 PART 情熱のダンシングNight!.ja, #07 PART つりあわねーんだよ.ja, #10 PART 言葉のいらないDAP.ja",
スノボ,スノボー,No definition found,Unlabeled,12,でも　お前が 昨日乗ったのは　<b>スノボ</b>じゃない,But what you rode yesterday wasn't snowboarding.,"#02 PART はじめてのサイコー！.ja, #03 PART 望まない勇者.ja, #07 PART つりあわねーんだよ.ja, #10 PART 言葉のいらないDAP.ja",
さっき,さっき,"1. a short while ago, a moment ago, just now, some time ago",N4,12,≪<b>さっき</b>より ２人の差が縮まってる！,≪The gap between the two has gotten smaller than before!,"#02 PART はじめてのサイコー！.ja, #03 PART 望まない勇者.ja, #04 PART 愛のマタドール、愛抱夢.ja, #05 PART 情熱のダンシングNight!.ja, #06 PART 湯けむりミステリースケート？!.ja, #09 PART あの時、俺たちは特別だった.ja, #10 PART 言葉のいらないDAP.ja",
とく,とく,"1. to untie, to unfasten, to unwrap, to undo, to unbind, to unpack<br>2. to unsew, to unstitch<br>3. to solve, to work out, to answer<br>4. to dispel (misunderstanding, etc.), to clear up, to remove (suspicion), to appease<br>5. to dissolve (a contract), to cancel, to remove (a prohibition), to lift (a ban), to raise (a siege)<br>6. to release (from duty), to relieve, to dismiss<br>7. to comb (out), to card, to untangle (hair)",Unlabeled,12,ウィール考え<b>とけ</b>よ！,Think about wheels!,"#02 PART はじめてのサイコー！.ja, #03 PART 望まない勇者.ja, #06 PART 湯けむりミステリースケート？!.ja, #07 PART つりあわねーんだよ.ja, #08 PART 宿命のトーナメント!.ja, #11 PART キング VS ザコ.ja",
世界,せかい,"1. the world, society, the universe<br>2. sphere, circle, world<br>3. world-renowned, world-famous<br>4. realm governed by one Buddha, space",N4,12,やめろ！　こんなくだらない<b>世界</b>に 僕を連れもどすな！,Stop it! Don't take me back to this stupid world!,"#02 PART はじめてのサイコー！.ja, #03 PART 望まない勇者.ja, #04 PART 愛のマタドール、愛抱夢.ja, #06 PART 湯けむりミステリースケート？!.ja, #08 PART 宿命のトーナメント!.ja, #11 PART キング VS ザコ.ja, #12 PART 俺たちの無限大!.ja",
勝負,しょうぶ,"1. victory or defeat<br>2. match, contest, game, bout",N2,12,だが廃工場で　もつれれば <b>勝負</b>はわからない,"But if we get tangled up in an abandoned factory, we won't know the outcome.","#03 PART 望まない勇者.ja, #04 PART 愛のマタドール、愛抱夢.ja, #05 PART 情熱のダンシングNight!.ja, #08 PART 宿命のトーナメント!.ja, #09 PART あの時、俺たちは特別だった.ja, #12 PART 俺たちの無限大!.ja",
終わる,おわる,"1. to end, to come to an end, to close, to finish",N1,11,今日の愛抱夢は 彼を潰すまで<b>終わら</b>ない,Today's love dream won't end until I crush him.,"#01 PART 熱い夜に雪が降る.ja, #04 PART 愛のマタドール、愛抱夢.ja, #06 PART 湯けむりミステリースケート？!.ja, #08 PART 宿命のトーナメント!.ja, #11 PART キング VS ザコ.ja, #12 PART 俺たちの無限大!.ja",
逃げる,にげる,"1. to escape, to run away",N4,11,<b>逃げ</b>たんじゃないの？ ランガには会いたくないから,Didn't you run away? Because I don't want to meet Ranga.,"#01 PART 熱い夜に雪が降る.ja, #02 PART はじめてのサイコー！.ja, #03 PART 望まない勇者.ja, #04 PART 愛のマタドール、愛抱夢.ja, #09 PART あの時、俺たちは特別だった.ja, #10 PART 言葉のいらないDAP.ja, #11 PART キング VS ザコ.ja",
レキ,レキ,Reki,Unlabeled,11,ビーフだ～！ シャドウと<b>レキ</b>がやるぞ！ 勇気を見せろ～！,It's beef! Shadow and Reki will do it! Show your courage!,"#01 PART 熱い夜に雪が降る.ja, #11 PART キング VS ザコ.ja",
見せる,みせる,"1. to show, to display",N5,11,ビーフだ～！ シャドウとレキがやるぞ！ 勇気を<b>見せろ</b>～！,It's beef! Shadow and Reki will do it! Show your courage!,"#01 PART 熱い夜に雪が降る.ja, #02 PART はじめてのサイコー！.ja, #03 PART 望まない勇者.ja, #04 PART 愛のマタドール、愛抱夢.ja, #08 PART 宿命のトーナメント!.ja, #10 PART 言葉のいらないDAP.ja, #11 PART キング VS ザコ.ja, #12 PART 俺たちの無限大!.ja",
いつ,いつ,"1. when, at what time, how soon<br>2. normal times, ordinary days",N5,11,<b>いつ</b>でも　どこでも どんなときでも　スケートは滑れる！,"You can skate anytime, anywhere, at any time!","#01 PART 熱い夜に雪が降る.ja, #02 PART はじめてのサイコー！.ja, #04 PART 愛のマタドール、愛抱夢.ja, #05 PART 情熱のダンシングNight!.ja, #07 PART つりあわねーんだよ.ja, #10 PART 言葉のいらないDAP.ja, #11 PART キング VS ザコ.ja",
さぁ,さ,"1. difference, variation<br>2. difference",Unlabeled,11,<b>さぁ</b>　行こう　二人の世界へ！,Let's go to our world!,"#01 PART 熱い夜に雪が降る.ja, #03 PART 望まない勇者.ja, #04 PART 愛のマタドール、愛抱夢.ja, #05 PART 情熱のダンシングNight!.ja, #07 PART つりあわねーんだよ.ja, #08 PART 宿命のトーナメント!.ja, #09 PART あの時、俺たちは特別だった.ja, #10 PART 言葉のいらないDAP.ja",
しまう,しまう,"1. to finish, to stop, to end, to put an end to, to bring to a close<br>2. to close (a business, etc.), to close down, to shut down, to shut up<br>3. to put away, to put back, to keep, to store<br>4. to do completely, to finish<br>5. to do accidentally, to do without meaning to, to happen to do",N3,11,そこをなんとか！ おねがい<b>しまっ</b>ス！,"Do something about that! Please, please!","#01 PART 熱い夜に雪が降る.ja, #02 PART はじめてのサイコー！.ja, #04 PART 愛のマタドール、愛抱夢.ja, #09 PART あの時、俺たちは特別だった.ja, #10 PART 言葉のいらないDAP.ja, #11 PART キング VS ザコ.ja, #12 PART 俺たちの無限大!.ja",
同じ,おなじ,"1. same, identical, equal, uniform, equivalent, similar, common (origin), changeless, alike<br>2. anyway, anyhow, in either case",N5,11,でも　スケートが好きって ところだけは<b>同じ</b>だから,But we're all the same in that we love skating.,"#01 PART 熱い夜に雪が降る.ja, #05 PART 情熱のダンシングNight!.ja, #08 PART 宿命のトーナメント!.ja, #10 PART 言葉のいらないDAP.ja, #11 PART キング VS ザコ.ja, #12 PART 俺たちの無限大!.ja",
スケボー,スケボー,"1. skateboard, skateboarding",Unlabeled,11,でも　<b>スケボー</b>やってるときだけは ちょっとかっこいいよ,But I'm kinda cool when I'm skateboarding,"#01 PART 熱い夜に雪が降る.ja, #02 PART はじめてのサイコー！.ja, #03 PART 望まない勇者.ja, #07 PART つりあわねーんだよ.ja, #08 PART 宿命のトーナメント!.ja, #09 PART あの時、俺たちは特別だった.ja, #10 PART 言葉のいらないDAP.ja, #12 PART 俺たちの無限大!.ja",
勝手に,かってに,"1. arbitrarily, of its own accord, voluntarily, wilfully, willfully, as one pleases",Unlabeled,11,何が？ なんで<b>勝手に</b>受けるんだよ,What? Why do you take it without permission?,"#01 PART 熱い夜に雪が降る.ja, #03 PART 望まない勇者.ja, #04 PART 愛のマタドール、愛抱夢.ja, #05 PART 情熱のダンシングNight!.ja, #06 PART 湯けむりミステリースケート？!.ja, #07 PART つりあわねーんだよ.ja, #09 PART あの時、俺たちは特別だった.ja, #10 PART 言葉のいらないDAP.ja",
早い,はやい,"1. fast, quick, hasty, brisk<br>2. early (in the day, etc.), premature<br>3. (too) soon, not yet, (too) early<br>4. easy, simple, quick",N5,11,<b>早い</b>ときは時速100キロを 超えることだってあるんだぜ,At times it can exceed 100km/h.,"#01 PART 熱い夜に雪が降る.ja, #02 PART はじめてのサイコー！.ja, #03 PART 望まない勇者.ja, #04 PART 愛のマタドール、愛抱夢.ja, #06 PART 湯けむりミステリースケート？!.ja, #08 PART 宿命のトーナメント!.ja, #09 PART あの時、俺たちは特別だった.ja, #12 PART 俺たちの無限大!.ja",
決まる,きまる,"1. to be decided, to be settled, to be fixed, to be arranged<br>2. to be unchanging, to be the same (as always), to be fixed, to be set<br>3. to be a fixed rule, to be destined, to be a convention, to be a custom, to be common knowledge<br>4. to be well executed (of a manoeuvre in a sport, game, etc.), to go well, to succeed, to connect (of a punch)<br>5. to look good (of clothing), to look sharp, to be stylish, to suit one, to be held in place (of a hairdo)<br>6. to be struck and held (of a pose in kabuki)",N1,11,[モニター]発表ってこれか！ [モニター]愛抱夢が勝つに<b>決まっ</b>てる！,[Monitor] Is this the announcement? [Monitor] Aihoumu is certain to win!,"#01 PART 熱い夜に雪が降る.ja, #02 PART はじめてのサイコー！.ja, #04 PART 愛のマタドール、愛抱夢.ja, #06 PART 湯けむりミステリースケート？!.ja, #07 PART つりあわねーんだよ.ja, #08 PART 宿命のトーナメント!.ja, #11 PART キング VS ザコ.ja",
サイコー,さいこう,"1. best, supreme, wonderful, finest<br>2. highest, maximum, most, uppermost, supreme",Unlabeled,11,お前の滑りは もっと<b>サイコー</b>だったぜ！,Your skating was even better!,"#01 PART 熱い夜に雪が降る.ja, #02 PART はじめてのサイコー！.ja, #03 PART 望まない勇者.ja, #07 PART つりあわねーんだよ.ja",
すぐ,すぐ,"1. immediately, at once, right away, directly<br>2. soon, before long, shortly<br>3. easily, readily, without difficulty<br>4. right (near), nearby, just (handy)<br>5. honest, upright, frank, straightforward",Unlabeled,11,≪チェリーブロッサムが来るぞ～！ ≪<b>すぐ</b>後ろにジョーだ！,≪Cherry Blossom is coming! ≪Joe is right behind you!,"#01 PART 熱い夜に雪が降る.ja, #02 PART はじめてのサイコー！.ja, #05 PART 情熱のダンシングNight!.ja, #06 PART 湯けむりミステリースケート？!.ja, #07 PART つりあわねーんだよ.ja, #08 PART 宿命のトーナメント!.ja, #10 PART 言葉のいらないDAP.ja, #11 PART キング VS ザコ.ja",
こう,こう,"1. in this way, thus, such<br>2. uh...",N4,11,<b>こう</b>なってしまっては 神道先生だけが頼りです,"If this happens, Shinto Sensei is the only person I can rely on.","#01 PART 熱い夜に雪が降る.ja, #02 PART はじめてのサイコー！.ja, #04 PART 愛のマタドール、愛抱夢.ja, #05 PART 情熱のダンシングNight!.ja, #08 PART 宿命のトーナメント!.ja, #10 PART 言葉のいらないDAP.ja, #11 PART キング VS ザコ.ja",
そこ,ソコ,There,N5,11,<b>そこ</b>をなんとか！ おねがいしまっス！,"Do something about that! Please, please!","#01 PART 熱い夜に雪が降る.ja, #02 PART はじめてのサイコー！.ja, #03 PART 望まない勇者.ja, #06 PART 湯けむりミステリースケート？!.ja, #07 PART つりあわねーんだよ.ja, #08 PART 宿命のトーナメント!.ja, #09 PART あの時、俺たちは特別だった.ja, #12 PART 俺たちの無限大!.ja",
どんな,どんな,"1. what kind of, what sort of, what<br>2. no matter what (kind of), whatever, any, all",N3,11,いつでも　どこでも <b>どんな</b>ときでも　スケートは滑れる！,"You can skate anytime, anywhere, at any time!","#01 PART 熱い夜に雪が降る.ja, #02 PART はじめてのサイコー！.ja, #04 PART 愛のマタドール、愛抱夢.ja, #07 PART つりあわねーんだよ.ja, #08 PART 宿命のトーナメント!.ja, #09 PART あの時、俺たちは特別だった.ja, #11 PART キング VS ザコ.ja",
最初,さいしょ,"1. beginning, outset, first, onset",N4,11,<b>最初</b>は後ろ足を 地面につけたまま—,"At first, keep your hind legs on the ground...","#02 PART はじめてのサイコー！.ja, #04 PART 愛のマタドール、愛抱夢.ja, #05 PART 情熱のダンシングNight!.ja, #06 PART 湯けむりミステリースケート？!.ja, #08 PART 宿命のトーナメント!.ja, #10 PART 言葉のいらないDAP.ja, #12 PART 俺たちの無限大!.ja",
トリック,トリック,1. trick,Unlabeled,11,ちょっと<b>トリック</b>がうまいぐらいで 調子に乗んな,"I'm just good at tricks, so don't get carried away.","#02 PART はじめてのサイコー！.ja, #03 PART 望まない勇者.ja, #04 PART 愛のマタドール、愛抱夢.ja, #05 PART 情熱のダンシングNight!.ja, #06 PART 湯けむりミステリースケート？!.ja",
さすが,さすが,"1. as one would expect, just as you'd expect (from), just like (someone)<br>2. still, all the same, after all<br>3. even ... (e.g. ""even a genius"")",Unlabeled,11,ヒュー！　<b>さすが</b>アメリカ帰り！,Huh! As expected of a return to America!,"#02 PART はじめてのサイコー！.ja, #03 PART 望まない勇者.ja, #06 PART 湯けむりミステリースケート？!.ja, #07 PART つりあわねーんだよ.ja, #09 PART あの時、俺たちは特別だった.ja, #10 PART 言葉のいらないDAP.ja, #11 PART キング VS ザコ.ja, #12 PART 俺たちの無限大!.ja",
忘れる,わすれる,"1. to forget, to leave carelessly, to be forgetful of, to forget about, to forget (an article)",N5,11,お<b>忘れ</b>かもしれませんが—,You may have forgotten—,"#02 PART はじめてのサイコー！.ja, #03 PART 望まない勇者.ja, #04 PART 愛のマタドール、愛抱夢.ja, #07 PART つりあわねーんだよ.ja, #08 PART 宿命のトーナメント!.ja, #09 PART あの時、俺たちは特別だった.ja, #11 PART キング VS ザコ.ja, #12 PART 俺たちの無限大!.ja",
ゴリラ,ゴリラ,"1. gorilla (Gorilla spp., esp. western gorilla, Gorilla gorilla)",Unlabeled,11,受けたほうが勝負を選ぶのは 当たり前だろ　脳筋<b>ゴリラ</b>が,It's only natural for a muscular gorilla to choose the winner if he receives it.,"#02 PART はじめてのサイコー！.ja, #03 PART 望まない勇者.ja, #04 PART 愛のマタドール、愛抱夢.ja, #06 PART 湯けむりミステリースケート？!.ja, #07 PART つりあわねーんだよ.ja, #09 PART あの時、俺たちは特別だった.ja",
あげる,あげる,"1. to raise, to elevate<br>2. to do up (one's hair)<br>3. to fly (a kite, etc.), to launch (fireworks, etc.), to surface (a submarine, etc.)<br>4. to land (a boat)<br>5. to deep-fry<br>6. to show someone (into a room)<br>7. to give<br>8. to send someone (away)<br>9. to enrol (one's child in school), to enroll<br>10. to increase (price, quality, status, etc.), to develop (talent, skill), to improve<br>11. to make (a loud sound), to raise (one's voice)<br>12. to earn (something desirable)<br>13. to praise<br>14. to give (an example, etc.), to cite<br>15. to summon up (all of one's energy, etc.)<br>16. to arrest<br>17. to nominate<br>18. to summon (for geishas, etc.)<br>19. to offer up (incense, a prayer, etc.) to the gods (or Buddha, etc.)<br>20. to bear (a child)<br>21. to conduct (a ceremony, esp. a wedding)<br>22. (of the tide) to come in<br>23. to vomit<br>24. to do for (the sake of someone else)<br>25. to complete ...<br>26. to humbly do ...",N4,11,ターン直後　<b>あげ</b>ていたノーズを 勢いよく降ろすことで—,"Immediately after the turn, by forcefully lowering the raised nose...","#02 PART はじめてのサイコー！.ja, #03 PART 望まない勇者.ja, #04 PART 愛のマタドール、愛抱夢.ja, #05 PART 情熱のダンシングNight!.ja, #08 PART 宿命のトーナメント!.ja, #09 PART あの時、俺たちは特別だった.ja, #10 PART 言葉のいらないDAP.ja, #12 PART 俺たちの無限大!.ja",
フフッ,フッ,"1. hah (derisively), pooh<br>2. pfft (of something disappearing), poof<br>3. huff, puff",Unlabeled,11,<b>フフッ</b>　身の程を知ってる うっせぇ！,"Hehe, I know what I'm up to!","#03 PART 望まない勇者.ja, #04 PART 愛のマタドール、愛抱夢.ja, #05 PART 情熱のダンシングNight!.ja, #06 PART 湯けむりミステリースケート？!.ja, #11 PART キング VS ザコ.ja, #12 PART 俺たちの無限大!.ja",
戻る,もどる,"1. to turn back (e.g. half-way)<br>2. to return, to go back<br>3. to recover (e.g. something lost), to be returned<br>4. to rebound, to spring back",N4,11,沖縄に<b>戻る</b>のも 本当はちょっと悩んだの,I was actually a little worried about returning to Okinawa.,"#04 PART 愛のマタドール、愛抱夢.ja, #06 PART 湯けむりミステリースケート？!.ja, #07 PART つりあわねーんだよ.ja, #09 PART あの時、俺たちは特別だった.ja, #11 PART キング VS ザコ.ja, #12 PART 俺たちの無限大!.ja",
ラブハッグ,ラブハッグ,1. love hug (Auto-translated),Unlabeled,11,<b>ラブハッグ</b>は　くらわない！,Love hugs don't cost anything!,"#04 PART 愛のマタドール、愛抱夢.ja, #05 PART 情熱のダンシングNight!.ja, #09 PART あの時、俺たちは特別だった.ja, #11 PART キング VS ザコ.ja",
まさか,まさか,"1. by no means, never!, well, I never!, you don't say!, certainly (not)<br>2. something unexpected, emergency<br>3. currently, for the time being, presently, for now<br>4. indeed, really, truly, unexpectedly",N3,11,<b>まさか</b>　愛抱夢も!?,Could it even be a love dream?,"#04 PART 愛のマタドール、愛抱夢.ja, #05 PART 情熱のダンシングNight!.ja, #06 PART 湯けむりミステリースケート？!.ja, #09 PART あの時、俺たちは特別だった.ja, #10 PART 言葉のいらないDAP.ja, #11 PART キング VS ザコ.ja, #12 PART 俺たちの無限大!.ja",
高野,高野,Takano,Unlabeled,11,<b>高野</b>がクロとなれば 僕も偽証罪を問われることになる,"If Takano turns out to be Kuro, I will also be charged with perjury.","#05 PART 情熱のダンシングNight!.ja, #07 PART つりあわねーんだよ.ja, #08 PART 宿命のトーナメント!.ja, #12 PART 俺たちの無限大!.ja",
桜屋敷,桜屋敷,Sakurayashiki,Unlabeled,11,《<b>桜屋敷</b>：俺がかわすことは 予想してたんだろ,《Sakurayashiki: You probably expected me to dodge.,"#05 PART 情熱のダンシングNight!.ja, #06 PART 湯けむりミステリースケート？!.ja, #09 PART あの時、俺たちは特別だった.ja",
赤毛,あかげ,"1. red hair, ginger hair",Unlabeled,11,てか　いつもスノーと一緒にいる <b>赤毛</b>のヤツ　だれ？,"By the way, who is that red-haired guy who is always with Snow?","#07 PART つりあわねーんだよ.ja, #09 PART あの時、俺たちは特別だった.ja, #10 PART 言葉のいらないDAP.ja, #11 PART キング VS ザコ.ja",
そりゃ,それ,"1. that, it<br>2. then, that point (in time), that time<br>3. there<br>4. you",Unlabeled,10,誰が勝つと思う？ <b>そりゃ</b>愛抱夢だろ！,Who do you think will win? That's a love dream!,"#01 PART 熱い夜に雪が降る.ja, #02 PART はじめてのサイコー！.ja, #04 PART 愛のマタドール、愛抱夢.ja, #05 PART 情熱のダンシングNight!.ja, #06 PART 湯けむりミステリースケート？!.ja, #08 PART 宿命のトーナメント!.ja, #09 PART あの時、俺たちは特別だった.ja, #10 PART 言葉のいらないDAP.ja, #12 PART 俺たちの無限大!.ja",
すむ,すむ,"1. to finish, to end, to be completed<br>2. to merely result in something less severe than expected<br>3. to feel at ease<br>4. to feel unease or guilt for troubling someone, to be sorry",Unlabeled,10,急に休んで　<b>すみ</b>ませんでした！,I'm sorry for taking a sudden break!,"#01 PART 熱い夜に雪が降る.ja, #02 PART はじめてのサイコー！.ja, #06 PART 湯けむりミステリースケート？!.ja, #07 PART つりあわねーんだよ.ja, #11 PART キング VS ザコ.ja",
わっ,わっ,"1. boo! (sound used to scare someone)<br>2. ugh (dissatisfaction, aggravation)<br>3. ulp (consternation)",Unlabeled,10,うおっ!?　う<b>わっ</b>　わっ！,Wow!? Wow!,"#01 PART 熱い夜に雪が降る.ja, #02 PART はじめてのサイコー！.ja, #03 PART 望まない勇者.ja, #06 PART 湯けむりミステリースケート？!.ja, #07 PART つりあわねーんだよ.ja, #08 PART 宿命のトーナメント!.ja",
おっ,おっ,"1. oh, oops",Unlabeled,10,これで３千円とか　シャドウの<b>おっ</b>さん マジ買い物上手だろ～！,"That's 3,000 yen. Shadow's old man must be really good at shopping!","#01 PART 熱い夜に雪が降る.ja, #03 PART 望まない勇者.ja, #04 PART 愛のマタドール、愛抱夢.ja, #06 PART 湯けむりミステリースケート？!.ja, #10 PART 言葉のいらないDAP.ja",
やつ,やっこ,"1. servant (esp. a samurai's attendant)<br>2. chivalrous man (Edo period)<br>3. cubed tofu (often served cold)<br>4. kite shaped like an Edo-period footman<br>5. Edo-period hairstyle worn by samurai's attendants<br>6. enslavement (of a woman; Edo-period punishment for her own or her husband's crime)<br>7. he, she, him, her",Unlabeled,10,本番では もっと頑丈な<b>やつ</b>にしてきなよ,I'll have to use something more sturdy for the actual performance.,"#01 PART 熱い夜に雪が降る.ja, #02 PART はじめてのサイコー！.ja, #03 PART 望まない勇者.ja, #05 PART 情熱のダンシングNight!.ja, #06 PART 湯けむりミステリースケート？!.ja, #07 PART つりあわねーんだよ.ja, #09 PART あの時、俺たちは特別だった.ja, #11 PART キング VS ザコ.ja",
