Expression,Reading,Meaning,Level,Frequency,Sentence,Translation,Episodes
答え,こたえ,"1. answer, reply, response, solution",N1,3,導き出した<b>答え</b>こそが,The answer I came up with is,S01E10
硬い,かたい,"1. hard, solid, tough<br>2. stiff, tight, wooden, unpolished (e.g. writing)<br>3. strong, firm (not viscous or easily moved)<br>4. safe, steady, honest, steadfast<br>5. obstinate, stubborn<br>6. bookish, formal, stuffy",N3,3,柔らかいけど たまに奥が<b>硬い</b>,Soft but sometimes hard inside,"S01E10, S01E11"
保証,ほしょう,"1. guarantee, security, assurance, pledge, warranty",N3,3,<b>保証</b>はないかもしれないけど,Although there may be no guarantees,"S01E11, S01E12"
ホテル,ホテル,1. hotel,N5,3,昨夜の<b>ホテル</b>での出来事でも,Even what happened at the hotel last night,"S01E11, S01E12"
寒い,さむい,"1. cold (e.g. weather)<br>2. uninteresting (esp. joke), lame, dull, weak, corny",N5,3,オオカミって暑いのと<b>寒い</b>の,Are wolves hot or cold?,S01E11
依然として,いぜんとして,"1. still, as yet, as of old",Unlabeled,3,俺は<b>依然として</b>,I still,S01E12
世の中,よのなか,"1. society, the world, the times",N3,3,こうして<b>世の中</b>が 少しずつ,"In this way, the world gradually changes",S01E12
クラスメート,クラスメイト,1. classmate,Unlabeled,2,お前さ 本当に<b>クラスメート</b>を,You really are my classmate.,"S01E01, S01E08"
食い物,くいもの,"1. food, foodstuff<br>2. prey, victim",Unlabeled,2,<b>食い物</b>と勘違いして,Mistaking it for food,"S01E01, S01E05"
犯人,はんにん,"1. offender, criminal, culprit",N3,2,きっと肉食獣の生徒が<b>犯人</b>ね,The culprit must be a carnivorous student.,"S01E01, S01E09"
代表,だいひょう,"1. representative, representation, delegation, type, example, model<br>2. switchboard number, main number",N3,2,<b>代表</b>って感じだったのに,I felt like a representative.,"S01E01, S01E10"
恐ろしい,おそろしい,"1. terrible, dreadful, terrifying, frightening<br>2. surprising, startling, tremendous, amazing",N3,2,<b>恐ろしい</b>ことが起きた,something terrible happened,"S01E01, S01E12"
内,うち,"1. inside, within<br>2. while (e.g. one is young), during, within (e.g. a day), in the course of<br>3. among, amongst, (out) of, between<br>4. in (secret, chaos, poverty, etc.), amidst, with (e.g. success)<br>5. within oneself, one's feelings, inner thoughts<br>6. we, our company, our organization<br>7. one's home, one's family<br>8. my spouse, my husband, my wife<br>9. signed on behalf of (husband's name) by his wife<br>10. I, me<br>11. imperial palace grounds<br>12. emperor",N3,2,テムは この部活<b>内</b>でしか―,Tim is only within this club...,"S01E01, S01E10"
ねたむ,ねたむ,"1. to be jealous of, to envy, to begrudge",Unlabeled,2,<b>ねたん</b>だやつが,The one who was jealous,"S01E01, S01E07"
いたむ,いたむ,"1. to hurt, to ache, to feel a pain<br>2. to be injured, to be spoiled (e.g. food), to be damaged",Unlabeled,2,パンダのおじさんが<b>いたん</b>だよ,There was an uncle who was a panda.,"S01E01, S01E11"
シマ,シマ,Shima,Unlabeled,2,ハア… <b>シマ</b>シマ同士で,Haa... with stripes on each other,S01E01
ナメ,なめる,"1. to lick, to lap, to suck<br>2. to taste<br>3. to experience (esp. a hardship)",Unlabeled,2,<b>ナメ</b>ないでよ,Don't underestimate me,"S01E01, S01E05"
渡せる,渡せる,1. I can give it to you (Auto-translated),Unlabeled,2,テムが<b>渡せ</b>ずにいたのを,Tim couldn't give it to me.,S01E01
悪口,わるぐち,"1. slander, bad-mouthing, abuse, insult, speaking ill (of)",N3,2,さっき あなたの<b>悪口</b>を,I just said something bad about you,S01E01
時に,ときに,"1. by the way, incidentally<br>2. sometimes, occasionally, on occasion<br>3. precisely (at that time), exactly, just (then), right (then)",Unlabeled,2,ここぞって<b>時に</b>必ず伝える,I will definitely tell you when this happens,"S01E01, S01E09"
ステキ,すてき,"1. lovely, wonderful, nice, great, fantastic, superb, cool",Unlabeled,2,舞台も ふだんも<b>ステキ</b>,Wonderful both on stage and in everyday life,S01E01
心得る,こころえる,"1. to know, to understand, to be aware of, to regard as, to take for<br>2. to consent, to agree",N2,2,隅々まで <b>心得</b>ているのだろう,I guess he knows every detail.,"S01E01, S01E10"
花形,はながた,"1. floral pattern, flourish, ornament<br>2. star (actor, player, etc.)",Unlabeled,2,<b>花形</b>役者であり 学園の権力者,A star actor and a person of authority at the school,"S01E01, S01E02"
飛ばす,とばす,"1. to let fly, to make fly, to send flying, to blow off (e.g. in the wind), to launch, to fire, to hurl, to shoot<br>2. to skip over, to leave out, to omit, to drop (e.g. a stitch)<br>3. to run fast, to drive fast, to gallop<br>4. to spray, to splash, to spatter<br>5. to say without reservation, to call out (e.g. a jeer), to rattle off (e.g. a joke)<br>6. to spread (e.g. a rumour), to circulate, to send out (a message), to issue (e.g. an appeal)<br>7. to transfer (to a less important post), to send away (e.g. to a provincial branch), to demote<br>8. to dispatch quickly (e.g. a reporter)<br>9. to get rid of, to burn off (alcohol)<br>10. to attack (e.g. with a leg manoeuvre)<br>11. to do vigorously, to do roughly, to do energetically",N3,2,風で<b>飛ばさ</b>れちゃったみたい,Looks like it was blown away by the wind,"S01E01, S01E03"
かゆい,かゆい,1. itchy,N2,2,痛くも<b>かゆく</b>もないわ,It doesn't hurt or itch,"S01E01, S01E09"
手伝う,てつだう,"1. to help, to assist, to aid<br>2. to contribute to, to be a factor in",N4,2,運ぶの<b>手伝う</b>よ,I'll help you carry it.,"S01E01, S01E07"
じき,じき,"1. time, season, period, phase, stage",Unlabeled,2,４文字で 爪は<b>じき</b>の獣？,A beast with claws in four letters?,S01E01
夕飯,ゆうはん,1. evening meal,N5,2,食堂で<b>夕飯</b> 食べましょう,Let's eat dinner at the restaurant,"S01E01, S01E05"
文字,もじ,"1. letter (of alphabet), character<br>2. writing",N3,2,４<b>文字</b>で 爪はじきの獣？,A beast with claws in four letters?,"S01E01, S01E09"
座る,すわる,"1. to sit, to squat<br>2. to assume (a position)<br>3. to hold steady, to hold still",N5,2,そこ <b>座っ</b>ていい？,Can I sit there?,"S01E01, S01E11"
ごはん,ごはん,1. cooked rice<br>2. meal,Unlabeled,2,<b>ごはん</b>が まずくなっちゃった,My meal went bad.,"S01E01, S01E05"
まずい,つたない,"1. poor-quality, shoddy, crude<br>2. unskillful, inexpert, maladroit, inept, foolish, clumsy<br>3. unlucky",N5,2,ごはんが <b>まずく</b>なっちゃった,My meal went bad.,"S01E01, S01E10"
事,こと,"1. thing, matter<br>2. incident, occurrence, event, something serious, trouble, crisis<br>3. circumstances, situation, state of affairs<br>4. work, business, affair<br>5. after an inflectable word, creates a noun phrase indicating something the speaker does not feel close to<br>6. nominalizing suffix<br>7. pretending to ..., playing make-believe ...<br>8. alias, also known as, otherwise known as, or<br>9. necessity, need<br>10. you should ..., I advise that you ..., it's important to ...",N3,2,この忙しい中 やっかい<b>事</b>が,"In this busy time, there is something troublesome","S01E01, S01E12"
ハーレクイン,ハーレクイン,1. harlequin,Unlabeled,2,<b>ハーレクイン</b>種は―,The Harlequin species is-,"S01E01, S01E05"
直す,なおす,"1. to cure, to heal<br>2. to fix, to correct, to repair<br>3. to do over again<br>4. to replace, to put back as it was<br>5. to convert (into a different state), to transform",N4,2,こいつに合わせて<b>直せ</b>,Fix it to suit this guy.,"S01E01, S01E06"
精,せい,"1. spirit, sprite, nymph<br>2. energy, vigor (vigour), strength<br>3. fine details<br>4. semen",Unlabeled,2,“我が水の<b>精</b>は この身が,“My water spirit is this body.,"S01E01, S01E02"
オディー,オディー,1. Odie (Auto-translated),Unlabeled,2,稽古だ　<b>オディー</b>のセリフを,It's time to practice Odie's lines.,S01E01
台本,だいほん,"1. script, libretto, scenario",N1,2,<b>台本</b>をたたき込め,Write down the script,S01E01
ヤギ,やぎ,1. goat,Unlabeled,2,君たち <b>ヤギ</b>の能力といったら,"You guys, what are the abilities of goats?","S01E01, S01E10"
ノック,ノック,"1. knock, knocking<br>2. fungo hitting, hitting balls for fielding practice",N3,2,<b>ノック</b>をしろ,knock,"S01E01, S01E03"
大会,たいかい,"1. mass meeting, convention, rally, conference, assembly, gathering<br>2. tournament, competition, contest, meet<br>3. grand event",N3,2,各<b>大会</b>において,At each tournament,"S01E01, S01E03"
２つ,ふたつ,1. two,Unlabeled,2,今 言った<b>２つ</b>の本番中のミスだ,These are the two mistakes I just mentioned during the performance.,"S01E01, S01E11"
ミス,ミス,"1. mistake, error, failure<br>2. Miss<br>3. myth",N3,2,あのルイ様が<b>ミス</b>したり,That Louis-sama made a mistake.,"S01E01, S01E03"
逆,ぎゃく,"1. reverse, opposite<br>2. converse (of a hypothesis, etc.)<br>3. inverse (function)",N3,2,<b>逆</b>に こっちが聞きたいよ,"On the contrary, I want to hear this","S01E01, S01E04"
なぜ,なぜ,"1. why, how",N5,2,<b>なぜ</b> そのようなことを,why do such a thing,"S01E01, S01E09"
勝ち,かち,"1. win, victory",N3,2,お前らの<b>勝ち</b>でいいよ,It's okay if you win,"S01E01, S01E06"
ごとし,ごとし,"1. like, as if, the same as",Unlabeled,2,片足の骨折<b>ごとき</b>で,片足の骨折ごときで,"S01E01, S01E04"
せいぜい,せいぜい,"1. at the most, at best, to the utmost, as much (far) as possible",Unlabeled,2,<b>せいぜい</b> うまいメシに,"At best, it's a good meal","S01E01, S01E09"
獰猛,どうもう,"1. ferocious, fierce, truculent, savage",Unlabeled,2,<b>獰猛</b>さは秘めているらしいな,It seems like he has hidden ferocity.,"S01E01, S01E10"
秘める,ひめる,"1. to hide, to keep to oneself",Unlabeled,2,獰猛さは<b>秘め</b>ているらしいな,It seems like he has hidden ferocity.,"S01E01, S01E12"
講堂,こうどう,"1. auditorium, lecture hall",N4,2,今夜 <b>講堂</b>に忍び込んで,Sneak into the auditorium tonight,"S01E01, S01E11"
無,む,"1. nothing, naught, nought, nil, zero<br>2. un-, non-",N3,2,卵サンドと豆乳 <b>無</b>調整のやつね,"Egg sandwich and soy milk, unadulterated.","S01E01, S01E05"
気取り,きどり,"1. affectation, pretension",Unlabeled,2,ヒーロー<b>気取り</b>するつもりか？,Are you trying to pretend to be a hero?,"S01E01, S01E07"
垂らす,たらす,"1. to dribble, to spill<br>2. to suspend, to hang down, to slouch, to dangle",Unlabeled,2,君は ヨダレ<b>垂らし</b>て,You're drooling,"S01E01, S01E09"
そば,そば,"1. buckwheat (Fagopyrum esculentum)<br>2. soba, Japanese buckwheat noodles",N5,2,“俺が <b>そば</b>に,“I’ll be by your side.,"S01E01, S01E12"
近寄る,ちかよる,"1. to approach, to draw near",N2,2,誰も<b>近寄ら</b>ない この場所に―,In this place where no one approaches...,"S01E01, S01E09"
停止,ていし,"1. stoppage, coming to a stop, halt, standstill<br>2. ceasing (movement, activity, etc.), suspension (of operations), interruption (e.g. of electricity supply), cutting off<br>3. suspension (of payment, licence, etc.), (temporary) prohibition, ban<br>4. suspension of music, dance, etc. as a sign of mourning for a prominent person",N2,2,２匹とも しばらく活動<b>停止</b>だ,Both have been inactive for a while.,"S01E01, S01E05"
泣く,なく,"1. to cry, to weep, to sob, to howl",N4,2,怖くて<b>泣き</b>たいとか―,Are you scared and want to cry?,"S01E01, S01E06"
眠れる,ねむれる,"1. sleeping, asleep, resting, slumbering<br>2. to be able to sleep",Unlabeled,2,そもそも <b>眠れ</b>ても,Even if I can sleep in the first place,"S01E02, S01E04"
じっと,じっと,"1. motionlessly (e.g. stand, wait), (be) still<br>2. fixedly (e.g. gaze, stare), intently (e.g. listen, think)<br>3. patiently (endure), stoically<br>4. firmly (e.g. hold), restrained",N3,2,<b>じっと</b>していたい,I want to stay still,"S01E02, S01E07"
テスト,テスト,"1. examination, quiz, test<br>2. test, tryout, trial<br>3. rehearsal (in filming)",N5,2,お前も 今日の数Ⅱの小<b>テスト</b>,"You too, today's Mathematics II quiz","S01E02, S01E05"
勉強,べんきょう,"1. study<br>2. diligence<br>3. discount, reduction",N5,2,生態学で<b>勉強</b>するよ,I'll study ecology,"S01E02, S01E07"
コロ,コロラド,1. Colorado<br>2. Colorado,Unlabeled,2,うーし <b>コロ</b>も早く,"Wow, Koro is quick too.",S01E02
熱い,あつい,"1. hot (thing)<br>2. passionate (feelings, etc.), ardent, hot (e.g. gaze)<br>3. hot (e.g. temper)<br>4. zealous, enthusiastic, fired up<br>5. intense, severe, extreme<br>6. hot (topic), of interest",N5,2,震わせるのも 体が<b>熱い</b>のも,The way it makes me tremble and the way my body feels hot,"S01E02, S01E10"
どれほど,どれほど,"1. how much (long, far)",Unlabeled,2,<b>どれほど</b>周りから,How many people around you,"S01E02, S01E07"
もがく,もがく,"1. to struggle, to writhe, to wriggle, to squirm<br>2. to act frantically, to make desperate efforts",Unlabeled,2,<b>もがい</b>てきたけど,I've been struggling though,"S01E02, S01E11"
そろそろ,そろそろ,"1. slowly, quietly, steadily, gradually, gingerly<br>2. soon, momentarily, before long, any time now",N4,2,<b>そろそろ</b>限界だよ,It's almost the limit,"S01E02, S01E04"
くい,くい,"1. regret, repentance",Unlabeled,2,<b>く</b>… 来るな　やめろ,Don't come. Stop.,"S01E02, S01E11"
抑え込む,おさえこむ,"1. to shut out one's opponents, to stop the other side from scoring",Unlabeled,2,幼い頃から自分を<b>抑え込ん</b>で,I suppressed myself from a young age.,"S01E02, S01E07"
ク,くるま,"1. car, automobile, vehicle<br>2. wheel, castor, caster",Unlabeled,2,<b>ク</b>… クソ クソ そんなバカな,Fuck... Shit Shit You're such an idiot.,S01E02
よこす,よこす,"1. to send, to forward<br>2. to hand over (e.g. money)",N2,2,俺に <b>よこせ</b>,Give it to me,"S01E02, S01E09"
足元,あしもと,"1. at one's feet, underfoot, one's step (as in ""watch your step"")<br>2. gait, pace, step<br>3. most recent, current",Unlabeled,2,暗くて <b>足元</b>が見えにくくて,It's dark and it's hard to see my feet,S01E02
にくい,にくい,"1. hateful, abominable, poor-looking, detestable<br>2. amazing, fantastic, admirable, lovely, wonderful",Unlabeled,2,暗くて 足元が見え<b>にくく</b>て,It's dark and it's hard to see my feet,"S01E02, S01E08"
いつか,いつか,"1. sometime, someday, one day, some time or other, the other day, in due course, in time",N3,2,でも <b>いつか</b>彼女には―,But someday she will...,"S01E02, S01E06"
肩,かた,1. shoulder,N3,2,私の<b>肩</b>に毛布をかけて去った,put a blanket over my shoulders and left,"S01E02, S01E05"
飲食,いんしょく,"1. food and drink, eating and drinking",Unlabeled,2,街の<b>飲食</b>店でも肉は一切 出ない,No meat is served at restaurants in town.,"S01E02, S01E07"
店,みせ,"1. store, shop, establishment, restaurant",N5,2,街の飲食<b>店</b>でも肉は一切 出ない,No meat is served at restaurants in town.,"S01E02, S01E07"
踏む,ふむ,"1. to step on, to tread on, to trample on<br>2. to set foot on (e.g. foreign soil), to stand on, to visit<br>3. to experience, to undergo<br>4. to follow (rules, principles, etc.), to go through (e.g. formalities), to complete<br>5. to estimate, to guess, to judge, to value, to appraise<br>6. to rhyme<br>7. to succeed to (e.g. the throne)",N4,2,さっきから 尻尾 <b>踏ん</b>でんの,You've been stepping on my tail for a while now.,S01E02
メガネ,めがね,"1. glasses, eyeglasses, spectacles<br>2. judgment, judgement, discrimination, discernment, insight",Unlabeled,2,マジで<b>メガネ</b> 作んなきゃ,I seriously need to make glasses,S01E02
遅れる,おくれる,"1. to be late, to be delayed, to fall behind schedule, to be overdue<br>2. to fall behind (in a race, one's studies, etc.), to lag behind, to be behind (the times)<br>3. to be bereaved of, to be preceded by (someone) in death<br>4. to be slow (of a clock or watch)",N4,2,あれ 私 数歩 <b>遅れ</b>てたら,"Well, I was a few steps behind.","S01E02, S01E08"
ストレス,ストレス,1. stress,N1,2,<b>ストレス</b>によるものなんですか？,Is it due to stress?,"S01E02, S01E06"
勝てる,勝てる,1. I can win (Auto-translated),Unlabeled,2,俺なら<b>勝てる</b>とでも思ったか,Did you think I could win?,"S01E02, S01E06"
ポッケ,ポッケ,1. pocket,Unlabeled,2,<b>ポッケ</b>にある小銭を落として,Drop the coins in your pocket,S01E02
小銭,こぜに,"1. small change, coins<br>2. small sum of money",N1,2,ポッケにある<b>小銭</b>を落として,Drop the coins in your pocket,S01E02
拾う,ひろう,"1. to pick up, to find, to gather",N4,2,<b>拾う</b>フリをして…,Pretend to pick it up...,S01E02
戦闘,せんとう,"1. battle, fight, combat",N1,2,性格と<b>戦闘</b>力が,personality and fighting ability,"S01E02, S01E10"
おや,おや,"1. oh!, oh?, my!",N3,2,<b>おや</b>おや 花形役者のお坊ちゃま,"Oh my goodness, star actor Ochama",S01E02
違反,いはん,"1. violation, offense, offence, breach, transgression, infringement, contravention",N3,2,校則<b>違反</b>を超えた大事件ですよ,This is a serious incident that goes beyond a violation of school rules.,"S01E02, S01E11"
称号,しょうごう,"1. title, name, degree",Unlabeled,2,次の“ビースター”の<b>称号</b>を,The title of the next “Beastar”,S01E02
狙う,ねらう,"1. to aim at<br>2. to be after (something), to have an eye on",N2,2,いいか 次は必ず首を<b>狙え</b>,"Listen, next time be sure to aim for the neck.","S01E02, S01E10"
全体,ぜんたい,"1. whole, entirety, whatever (is the matter)",N3,2,学校<b>全体</b>の統率を担い―,Responsible for the leadership of the entire school.,"S01E02, S01E08"
差別,さべつ,"1. distinction, differentiation, discrimination<br>2. discrimination (against people)",N3,2,この世界の<b>差別</b>や恐怖を超越する,Transcend the discrimination and fear of this world,"S01E02, S01E08"
恐怖,きょうふ,"1. fear, dread, dismay, terror, horror, scare, panic",N3,2,<b>恐怖</b>に震える姿を俺に見せろ,Show me how you tremble in fear,"S01E02, S01E11"
地位,ちい,"1. (social) position, status",N3,2,英雄的<b>地位</b>,heroic status,"S01E02, S01E08"
返す,かえす,"1. to return (something), to restore, to put back<br>2. to turn over, to turn upside down, to overturn<br>3. to pay back, to retaliate, to reciprocate<br>4. to respond (with), to retort, to reply, to say back<br>5. to do ... back (e.g. speak back, throw back)<br>6. to do again, to do repeatedly",N5,2,これで<b>返し</b>たことになるかな,I guess this means I've returned it,"S01E02, S01E06"
スタイル,スタイル,"1. (one's) figure, build, physique, shape<br>2. style",N3,2,いつまで その<b>スタイル</b>を,How long will you keep that style?,"S01E02, S01E10"
正義,せいぎ,"1. justice, right, righteousness<br>2. correct meaning, correct explanation",N1,2,大した<b>正義</b>感だな,That's a great sense of justice,"S01E02, S01E09"
彼ら,かれら,"1. they, them",N4,2,死に神さん　どうして<b>彼ら</b>は,"God of death, why are they?","S01E02, S01E04"
森羅万象,しんらばんしょう,"1. all things in nature, the whole creation",Unlabeled,2,<b>森羅万象</b> あらゆる使者が,"The universe, all the messengers","S01E02, S01E04"
あらゆる,あらゆる,"1. all, every",N3,2,森羅万象 <b>あらゆる</b>使者が,"The universe, all the messengers","S01E02, S01E04"
使者,ししゃ,"1. messenger, envoy, emissary",Unlabeled,2,森羅万象 あらゆる<b>使者</b>が,"The universe, all the messengers","S01E02, S01E04"
運命,うんめい,"1. fate, destiny, lot",N1,2,<b>運命</b>に逆らうとは,What does it mean to go against fate?,"S01E02, S01E04"
逆らう,さからう,"1. to go against, to oppose, to disobey, to defy",N3,2,運命に<b>逆らう</b>とは,What does it mean to go against fate?,"S01E02, S01E04"
一幕,ひとまく,1. one act,Unlabeled,2,<b>一幕</b> 第５場 オーケーです,Act 1 Scene 5 Okay.,S01E02
学内,がくない,1. within the school,Unlabeled,2,新歓は<b>学内</b>公演では,Welcome to the school performance,"S01E02, S01E06"
示す,しめす,"1. to (take out and) show, to demonstrate, to tell, to exemplify, to make apparent<br>2. to point out (finger, clock hand, needle, etc.)<br>3. to indicate, to show, to represent, to signify, to display",N3,2,舞台で<b>示す</b>んだ,I'll show it on stage,"S01E02, S01E09"
衣装,いしょう,"1. clothing, costume, outfit, garment, dress",N1,2,<b>衣装</b> 取っておくのも不気味だよな,It's creepy to keep costumes.,"S01E02, S01E12"
だからこそ,だからこそ,1. for this reason,Unlabeled,2,<b>だからこそ</b> みんな,That's why everyone,"S01E02, S01E11"
あまり,あまり,"1. remainder, remnant, rest, balance, surplus, remains (of a meal), leftovers<br>2. (not) very, (not) much<br>3. too much, excessively, overly<br>4. extreme, great, severe, tremendous, terrible<br>5. more than, over",N5,2,<b>あまり</b>触れたがらない,I don't want to touch it much,"S01E02, S01E06"
オッケー,オッケー,"1. OK, okay",Unlabeled,2,音響も<b>オッケー</b>です,The sound is also okay.,S01E02
重圧,じゅうあつ,"1. strong pressure, heavy pressure",Unlabeled,2,一体 どれほどの<b>重圧</b>か…,Just how much pressure is there...,S01E02
コミュニケーション,コミュニケーション,1. communication,N1,2,<b>コミュニケーション</b>上手に,communicate well,"S01E02, S01E06"
用事,ようじ,"1. tasks, things to do, errand, business (to take care of), affairs, engagement",N4,2,俺 <b>用事</b> 思い出しちゃった,I remembered what I had to do.,S01E02
思い出,おもいで,"1. memories, recollections, reminiscence",N3,2,かけがえのない私たちの<b>思い出</b>は,Our irreplaceable memories,"S01E02, S01E07"
おごる,おごる,"1. to give (someone) a treat<br>2. to be extravagant, to live luxuriously<br>3. to be proud, to be haughty",Unlabeled,2,アリシェイク 今度<b>おごる</b>から,"Ali Sheikh, I'll buy you something next time.","S01E02, S01E05"
会,え,"1. gathering (esp. Buddhist, festive, etc.)",N3,2,新入生歓迎<b>会</b>に使う花を,Flowers for the welcome party for new students,"S01E02, S01E07"
ウワサ,ウワサ,1. The Loudest Whisper: Uwasa No Futari,Unlabeled,2,結構 <b>ウワサ</b>になってるんだけど,There are quite a few rumors about it.,"S01E02, S01E03"
権利,けんり,"1. right, privilege",N3,2,会話する<b>権利</b>すら 本当はないのに,I don't even have the right to have a conversation.,"S01E02, S01E12"
本当は,本当は,1. Actually (Auto-translated),Unlabeled,2,会話する権利すら <b>本当は</b>ないのに,I don't even have the right to have a conversation.,"S01E02, S01E04"
ふん,ふん,"1. minute (unit of time)<br>2. fun (one tenth of a monme, 5.787 grains)",Unlabeled,2,<b>ふん</b>ふん… バラが欲しいのね,Hmm... I want a rose.,S01E02
ただし,ただし,"1. but, however, provided that",Unlabeled,2,<b>ただし</b> 条件があるの,"However, there are conditions",S01E02
提供,ていきょう,"1. offer, tender, providing, supplying, making available, donating (blood, organs, etc.)<br>2. sponsoring (a TV program)",N1,2,<b>提供</b>はできないもの,What cannot be provided,"S01E02, S01E06"
アハハッ,アハハッ,1. Ahaha (Auto-translated),Unlabeled,2,<b>アハハッ</b> まあね,Ahaha well,"S01E02, S01E11"
記憶,きおく,"1. memory, recollection, remembrance<br>2. storage",N3,2,<b>記憶</b>がないし…,I don't remember...,"S01E02, S01E11"
包帯,ほうたい,"1. bandage, dressing",N2,2,<b>包帯</b> 巻いてたでしょ？,"You had a bandage wrapped around you, right?","S01E02, S01E08"
巻く,まく,"1. to wind, to coil, to roll, to wear (e.g. turban, scarf)<br>2. to envelope, to shroud<br>3. to outflank, to skirt<br>4. to link (verse)<br>5. to move ahead (three hours, etc.), to move up",N2,2,包帯 <b>巻い</b>てたでしょ？,"You had a bandage wrapped around you, right?","S01E02, S01E08"
助かる,たすかる,"1. to be saved, to be rescued, to survive<br>2. to escape harm, to be spared damage<br>3. to be helped, to be saved trouble",N2,2,<b>助かっ</b>たわ,I was saved.,"S01E02, S01E06"
回復,かいふく,"1. restoration, rehabilitation, recovery, return, replevin, improvement<br>2. recovery (from an illness), recuperation, convalescence",N3,2,きっと<b>回復</b>するわ,I'm sure you'll recover,"S01E02, S01E11"
なるほど,なるほど,"1. I see, that's right, indeed",N4,2,必死になれば<b>なるほど</b>,The more desperate you become,"S01E02, S01E05"
世話,せわ,"1. looking after, help, aid, assistance",N4,2,植物の<b>世話</b>したあとって,After taking care of the plants,"S01E02, S01E10"
ほとんど,ほとんど,"1. mostly, nearly, practically, well-nigh, almost invariably, all but, just about, almost",N4,2,俺は <b>ほとんど</b> しゃべってないし,I don't talk much,"S01E02, S01E05"
