Expression,Reading,Meaning,Level,Frequency,Sentence,Translation,Episodes,Image
紹介,しょうかい,"1. introduction, presentation, referral, listing",N4,3,そう　その川上さんの<b>紹介</b>でね,"Yes, with Mr. Kawakami's introduction.",[shincaps] K-ON! Movie (AT-X 1440x1080 MPEG2 AAC),
なれる,なれる,"1. to get used to, to grow accustomed to, to become familiar with<br>2. to become skilled in, to become experienced at<br>3. to become tame, to become domesticated<br>4. to get used to doing",Unlabeled,3,やっと２人きりに<b>なれ</b>たね,We were finally alone together.,[shincaps] K-ON! Movie (AT-X 1440x1080 MPEG2 AAC),
昔,むかし,"1. olden days, former",N4,3,とっくの<b>昔</b>に気づいてたぞ,I noticed it a long time ago,[shincaps] K-ON! Movie (AT-X 1440x1080 MPEG2 AAC),
ジャン,ジャン,Jyan,Unlabeled,3,♬～一緒にね！！　<b>ジャン</b>！！,♬～Together! ! Jean! !,[shincaps] K-ON! Movie (AT-X 1440x1080 MPEG2 AAC),
きっと,きっと,"1. surely, undoubtedly, almost certainly, most likely (e.g. 90 percent)<br>2. sternly, severely<br>3. having no slack, rigid, stiff, tight<br>4. suddenly, abruptly, instantly",N4,3,<b>きっと</b>出逢えるよ,I'm sure we'll meet,[shincaps] K-ON! Movie (AT-X 1440x1080 MPEG2 AAC),
おっきい,おおきい,"1. big, large, great<br>2. loud<br>3. extensive, spacious<br>4. important, decisive, valuable<br>5. older, grown up",Unlabeled,3,スケールの<b>おっきい</b>曲が,A song with a big scale,[shincaps] K-ON! Movie (AT-X 1440x1080 MPEG2 AAC),
おやすみ,おやすみ,"1. holiday, day off, absence<br>2. sleep, rest<br>3. Good night",N2,3,<b>おやすみ</b>　唯ちゃん,Good night Yui-chan,[shincaps] K-ON! Movie (AT-X 1440x1080 MPEG2 AAC),
ブラック,ブラック,"1. black<br>2. black (coffee), without cream or milk<br>3. exploitative (of one's employees), immoral, corrupt<br>4. boldface, blackface, heavy-faced type",Unlabeled,3,☎ラブ・クライシスと<b>ブラック</b>フリルが,☎Love Crisis and Black Frill,[shincaps] K-ON! Movie (AT-X 1440x1080 MPEG2 AAC),
フリル,フリル,1. frill,Unlabeled,3,☎ラブ・クライシスとブラック<b>フリル</b>が,☎Love Crisis and Black Frill,[shincaps] K-ON! Movie (AT-X 1440x1080 MPEG2 AAC),
あなた,きほう,"1. your home, your residence<br>2. you (referring to one's equal; epistolary style)",N5,3,☎<b>あなた</b>達にもお願いできない？,☎Can I ask you guys a favor too?,[shincaps] K-ON! Movie (AT-X 1440x1080 MPEG2 AAC),
送る,おくる,"1. to send (a thing), to dispatch, to despatch, to transmit<br>2. to take or escort (a person somewhere), to see off (a person)<br>3. to bid farewell (to the departed), to bury<br>4. to spend (time), to live one's life<br>5. to pass (down the line)<br>6. to affix okurigana",N4,3,<b>送っ</b>てることになるの？,Does that mean I'm sending it?,[shincaps] K-ON! Movie (AT-X 1440x1080 MPEG2 AAC),
ピース,ピース,"1. peace<br>2. peas<br>3. piece<br>4. peace sign, V sign",Unlabeled,3,それ　<b>ピース</b>か？,Is that peace?,[shincaps] K-ON! Movie (AT-X 1440x1080 MPEG2 AAC),
困る,こまる,"1. to be troubled, to have difficulty, to be in a fix, to be at a loss, to be stumped, to be embarrassed<br>2. to be bothered, to be inconvenienced, to be annoyed<br>3. to be badly off, to be hard up, to be in straitened circumstances",N5,3,ないと<b>困る</b>よ,I'd be in trouble without it,[shincaps] K-ON! Movie (AT-X 1440x1080 MPEG2 AAC),
お好み焼き,おこのみやき,"1. okonomiyaki, savoury pancake containing meat or seafood and vegetables",Unlabeled,3,<b>お好み焼き</b>＆ごはん,Okonomiyaki & rice,[shincaps] K-ON! Movie (AT-X 1440x1080 MPEG2 AAC),
急,きゅう,"1. sudden, abrupt, unexpected<br>2. urgent, pressing<br>3. steep, sharp, precipitous<br>4. rapid, swift, fast<br>5. emergency, crisis, danger<br>6. urgency, hurrying, haste<br>7. (in gagaku or noh) end of a song",N4,3,<b>急</b>に何かしてたことを,What were you doing suddenly?,[shincaps] K-ON! Movie (AT-X 1440x1080 MPEG2 AAC),
泣く,なく,"1. to cry, to weep, to sob, to howl",N4,3,絶対<b>泣い</b>ちゃうわね＞,I'm definitely going to cry,[shincaps] K-ON! Movie (AT-X 1440x1080 MPEG2 AAC),
雨,あめ,"1. rain<br>2. rainy day, rainy weather<br>3. the November suit (in hanafuda)",N5,3,♬～<b>雨</b>は　私に話しかけるよ,♬~The rain speaks to me,[shincaps] K-ON! Movie (AT-X 1440x1080 MPEG2 AAC),
思い,おもい,"1. thought<br>2. imagination, mind, heart<br>3. desire, wish, hope, expectation<br>4. love, affection<br>5. feelings, emotion, sentiment, experience",Unlabeled,3,<b>思い</b>を歌に込めたから,Because I put my thoughts into a song,[shincaps] K-ON! Movie (AT-X 1440x1080 MPEG2 AAC),
うまい,うまい,"1. skillful, skilful, clever, expert, wise, successful<br>2. delicious, appetizing, appetising, tasty<br>3. fortunate, splendid, promising",N4,3,<b>うまく</b>演奏できるかな,I wonder if I can play well?,[shincaps] K-ON! Movie (AT-X 1440x1080 MPEG2 AAC),
仲間,ちゅうげん,"1. samurai's attendant, footman",N3,3,♬～これからも<b>仲間</b>だから,♬～We will always be friends,[shincaps] K-ON! Movie (AT-X 1440x1080 MPEG2 AAC),
てらっしゃる,て,"1. hand, arm<br>2. forepaw, foreleg<br>3. handle",Unlabeled,2,行っ<b>てらっしゃい</b>,Please go,[shincaps] K-ON! Movie (AT-X 1440x1080 MPEG2 AAC),
解散,かいさん,"1. breaking up (e.g. meeting), dispersing (e.g. crowd)<br>2. dissolving (company, organization, etc.), liquidating, disbanding<br>3. dissolving (diet, parliament, etc.)",N2,2,もう軽音部は<b>解散</b>しちゃうかも,Maybe the light music club will disband already.,[shincaps] K-ON! Movie (AT-X 1440x1080 MPEG2 AAC),
方向,ほうこう,"1. direction, orientation, bearing, way<br>2. course (e.g. of action)",N3,2,目指す<b>方向</b>が違ってきたんだ,The direction I'm aiming for has changed,[shincaps] K-ON! Movie (AT-X 1440x1080 MPEG2 AAC),
やつ,やっこ,"1. servant (esp. a samurai's attendant)<br>2. chivalrous man (Edo period)<br>3. cubed tofu (often served cold)<br>4. kite shaped like an Edo-period footman<br>5. Edo-period hairstyle worn by samurai's attendants<br>6. enslavement (of a woman; Edo-period punishment for her own or her husband's crime)<br>7. he, she, him, her",Unlabeled,2,音楽性の違いって<b>やつ</b>だよ,It's the difference in musicality.,[shincaps] K-ON! Movie (AT-X 1440x1080 MPEG2 AAC),
覚える,おぼえる,"1. to memorize, to memorise, to commit to memory, to learn by heart, to bear in mind, to remember<br>2. to learn, to pick up, to acquire<br>3. to feel<br>4. to think, to regard",N5,2,１つコードを<b>覚えれ</b>ば,If you remember one code,[shincaps] K-ON! Movie (AT-X 1440x1080 MPEG2 AAC),
パンツ,パンツ,"1. underpants, pants, briefs, panties, shorts, knickers<br>2. trousers (esp. women's), jodhpurs, breeches, pants, trunks (e.g. swimming)",N2,2,転んで<b>パンツ</b>見せてたくせに,Even though I fell down and showed my panties,[shincaps] K-ON! Movie (AT-X 1440x1080 MPEG2 AAC),
話す,はなす,"1. to talk, to speak, to converse, to chat<br>2. to tell, to explain, to narrate, to mention, to describe, to discuss<br>3. to speak (a language)",N5,2,コソコソ<b>話し</b>てたのはこれか！,Is this what you were secretly talking about?,[shincaps] K-ON! Movie (AT-X 1440x1080 MPEG2 AAC),
元気,げんき,"1. lively, full of spirit, energetic, vigorous, vital, spirited<br>2. healthy, well, fit, in good health",N5,2,この間はどうも　<b>元気</b>？,How are you doing during this time?,[shincaps] K-ON! Movie (AT-X 1440x1080 MPEG2 AAC),
フワフワ,ふわふわ,"1. lightly (floating, drifting, etc.), buoyantly<br>2. soft, fluffy, spongy<br>3. unsteadily, flightily, fickly, frivolously",Unlabeled,2,<b>フワフワ</b>してるのは　もう,It's already fluffy,[shincaps] K-ON! Movie (AT-X 1440x1080 MPEG2 AAC),
軽い,かるい,"1. light (i.e. not heavy), feeling light (i.e. offering little resistance, moving easily)<br>2. light (i.e. of foot), effortless, nimble, agile<br>3. non-serious, minor, unimportant, trivial<br>4. slight, small, gentle, soft, easy, lighthearted (e.g. joke)<br>5. easy, simple<br>6. indiscriminate",N5,2,<b>軽く</b>１０００杯は　いってるかも,I might easily have 1000 cups.,[shincaps] K-ON! Movie (AT-X 1440x1080 MPEG2 AAC),
っちゃ,じゃあ,"1. then, well, so, well then<br>2. be, is",Unlabeled,2,って言ったの　り<b>っちゃ</b>んじゃん,That's what Ricchan said.,[shincaps] K-ON! Movie (AT-X 1440x1080 MPEG2 AAC),
ハーモニカ,ハーモニカ,"1. harmonica, mouth organ<br>2. cunnilingus<br>3. hypodermic syringe",Unlabeled,2,弾けないわ　<b>ハーモニカ</b>は吹けないわ,I can't play the harmonica.,[shincaps] K-ON! Movie (AT-X 1440x1080 MPEG2 AAC),
チャラ,チャラ,"1. cancelling (a debt), forgiving (a debt), being even<br>2. forgetting (what was said or done), pretending (something never happened)",Unlabeled,2,ムギのチャン<b>チャラ</b>おかしいも,Wheat Chanchara is funny,[shincaps] K-ON! Movie (AT-X 1440x1080 MPEG2 AAC),
元,もと,"1. origin, source<br>2. base, basis, foundation, root<br>3. cause<br>4. ingredient, material<br>5. (somebody's) side, (somebody's) location<br>6. original cost (or capital, principal, etc.)<br>7. (plant) root, (tree) trunk<br>8. first section of a waka<br>9. counter for blades of grass, tree trunks, etc., and for falcons (in falconry)<br>10. handle (chopsticks, brush, etc.), grip",N3,2,<b>元</b>はといえば　ムギちゃんがお菓子,"Originally, Mugi-chan was the candy.",[shincaps] K-ON! Movie (AT-X 1440x1080 MPEG2 AAC),
いい加減,いいかげん,"1. irresponsible, perfunctory, careless<br>2. lukewarm, half-baked, halfhearted, vague<br>3. reasonable, moderate<br>4. considerably, quite, rather, pretty",N1,2,私　こういう　<b>いい加減</b>な部だとは,I never thought I'd be this lazy.,[shincaps] K-ON! Movie (AT-X 1440x1080 MPEG2 AAC),
一度,いちど,"1. once, one time, on one occasion<br>2. temporarily, for a moment<br>3. one degree, one tone, one musical interval",N4,2,もう<b>一度</b>　入る勇気がない,I don't have the courage to enter again,[shincaps] K-ON! Movie (AT-X 1440x1080 MPEG2 AAC),
うふ,うふふ,1. tee-hee,Unlabeled,2,♬～<b>うふ</b>うふ　ハートのあたり,♬～Ufuufu Around the heart,[shincaps] K-ON! Movie (AT-X 1440x1080 MPEG2 AAC),
あたり,あたり,"1. (in the) neighbourhood, neighborhood, vicinity, nearby, surroundings<br>2. around, about, or thereabouts<br>3. for instance, say, such as",Unlabeled,2,さっき<b>あたり</b>から何となく,Somehow from around now,[shincaps] K-ON! Movie (AT-X 1440x1080 MPEG2 AAC),
幸せ,しあわせ,"1. happiness, good fortune, luck, blessing",N3,2,私達を<b>幸せ</b>にしてくれた,made us happy,[shincaps] K-ON! Movie (AT-X 1440x1080 MPEG2 AAC),
反省会,はんせいかい,"1. evaluation meeting, postmortem session, review meeting",Unlabeled,2,さっきの<b>反省会</b>でもするか,Shall we do it at the review meeting earlier?,[shincaps] K-ON! Movie (AT-X 1440x1080 MPEG2 AAC),
ドキドキ,ドキドキ,"1. thump-thump, bang-bang, pit-a-pat, pitapat, pitter-patter<br>2. to beat fast (of one's heart), to throb, to pound, to palpitate",Unlabeled,2,<b>ドキドキ</b>させられると思ったけどな,I thought it would make my heart flutter.,[shincaps] K-ON! Movie (AT-X 1440x1080 MPEG2 AAC),
琴吹,琴吹,Kotobuki,Unlabeled,2,<b>琴吹</b>家自慢の紅茶よ,This is the Kotobuki family's proud tea.,[shincaps] K-ON! Movie (AT-X 1440x1080 MPEG2 AAC),
自慢,じまん,"1. pride, boast",N3,2,琴吹家<b>自慢</b>の紅茶よ,This is the Kotobuki family's proud tea.,[shincaps] K-ON! Movie (AT-X 1440x1080 MPEG2 AAC),
枚,まい,1. counter for flat objects (e.g. sheets of paper)<br>2. counter for positions or roles<br>3. counter for food portions (now only gyōza and soba)<br>4. counter for ranking level,N1,2,１<b>枚</b>ずつ　皮はがして食べようぜ,Let's peel off the skin and eat one by one.,[shincaps] K-ON! Movie (AT-X 1440x1080 MPEG2 AAC),
開ける,あける,"1. to open (a door, etc.), to unwrap (e.g. parcel, package), to unlock<br>2. to open (for business, etc.)<br>3. to empty, to remove, to make space, to make room<br>4. to move out, to clear out<br>5. to be away from (e.g. one's house), to leave (temporarily)<br>6. to dawn, to grow light<br>7. to end (of a period, season)<br>8. to begin (of the New Year)<br>9. to leave (one's schedule) open, to make time (for)<br>10. to make (a hole), to open up (a hole)",N5,2,<b>開ける</b>んだよって　お父さんが,My father told me to open it.,[shincaps] K-ON! Movie (AT-X 1440x1080 MPEG2 AAC),
年間,ねんかん,1. (period of) a year<br>2. during an era,N3,2,＜３<b>年間</b>　ここで　みんなと,<3 years here with everyone,[shincaps] K-ON! Movie (AT-X 1440x1080 MPEG2 AAC),
受かる,うかる,1. to pass (examination),N1,2,だって　もう大学<b>受かっ</b>たし,Because I already got accepted to university.,[shincaps] K-ON! Movie (AT-X 1440x1080 MPEG2 AAC),
ハサミ,はさみ,"1. scissors, shears, clippers<br>2. hole punch",Unlabeled,2,私　<b>ハサミ</b>持ってますよ,I have scissors,[shincaps] K-ON! Movie (AT-X 1440x1080 MPEG2 AAC),
開く,ひらく,"1. to open, to undo, to unseal, to unpack<br>2. to bloom, to unfold, to spread out<br>3. to open (for business, e.g. in the morning)<br>4. to be wide (gap, etc.), to widen<br>5. to hold (meeting, party, etc.), to give, to open<br>6. to found (nation, dynasty, sect, etc.), to open (a new business), to set up, to establish, to start<br>7. to open (ports, borders, etc.)<br>8. to open (an account)<br>9. to open up (new land, path, etc.), to clear, to develop<br>10. to open (a file, etc.)<br>11. to extract (root), to reduce (equation)<br>12. to cut open (fish)<br>13. to change (kanji into hiragana)<br>14. to flare (e.g. skirt)<br>15. to slacken (into a poor posture)",N5,2,あ～　<b>開い</b>た,"Ah, it opened",[shincaps] K-ON! Movie (AT-X 1440x1080 MPEG2 AAC),
名,な,"1. name, given name<br>2. title<br>3. fame, renown, reputation<br>4. pretext, pretense, justification, appearance",N3,2,体張ってバンド<b>名</b>を表してますね,They stand out and represent the band name.,[shincaps] K-ON! Movie (AT-X 1440x1080 MPEG2 AAC),
会議,かいぎ,"1. meeting, conference, session, assembly, council, convention, congress",N4,2,そんな大事な<b>会議</b>が！,Such an important meeting!,[shincaps] K-ON! Movie (AT-X 1440x1080 MPEG2 AAC),
足りる,たりる,"1. to be sufficient, to be enough<br>2. to be worth doing, to be worthy of, to deserve<br>3. to do (the job), to serve, to answer",N4,2,出席日数が<b>足り</b>てるか　赤点取った,Did you attend enough days? I got a red mark.,[shincaps] K-ON! Movie (AT-X 1440x1080 MPEG2 AAC),
取る,とる,"1. to take, to pick up, to grab, to catch<br>2. to pass, to hand, to give<br>3. to get, to obtain, to acquire, to win, to receive, to earn, to take (e.g. a vacation)<br>4. to adopt (a method, proposal, etc.), to take (a measure, attitude, etc.), to choose<br>5. to remove, to get rid of, to take off<br>6. to take away, to steal, to rob<br>7. to eat, to have (e.g. lunch), to take (e.g. vitamins)<br>8. to pick (e.g. flowers), to gather, to extract (e.g. juice), to catch (e.g. fish)<br>9. to take up (time, space), to occupy, to spare, to set aside<br>10. to secure, to reserve, to save, to put aside, to keep<br>11. to take (e.g. a joke), to interpret, to understand, to make out, to grasp<br>12. to record, to take down<br>13. to subscribe to (e.g. a newspaper), to take, to buy, to get<br>14. to order, to have delivered<br>15. to charge, to fine, to take (tax)<br>16. to take (e.g. a wife), to take on (e.g. an apprentice), to adopt, to accept<br>17. to compete (in sumo, cards, etc.), to play",N5,2,出席日数が足りてるか　赤点<b>取っ</b>た,Did you attend enough days? I got a red mark.,[shincaps] K-ON! Movie (AT-X 1440x1080 MPEG2 AAC),
審査,しんさ,"1. judging, inspection, examination, investigation, review",N1,2,数が多くないか　<b>審査</b>するのよ,I'll check to see if there are too many.,[shincaps] K-ON! Movie (AT-X 1440x1080 MPEG2 AAC),
マネ,まね,"1. imitating, copying, mimicry<br>2. behavior, behaviour, action, conduct",Unlabeled,2,ＤＥＡＴＨ　ＤＥＶＩＬの<b>マネ</b>してたんだよ,I was imitating DEATH DEVIL.,[shincaps] K-ON! Movie (AT-X 1440x1080 MPEG2 AAC),
今更,いまさら,"1. now (when it is already much too late), at this stage<br>2. afresh, anew, again",N1,2,⚟<b>今更</b>　ゴマすってもね,⚟Even if you give up now,[shincaps] K-ON! Movie (AT-X 1440x1080 MPEG2 AAC),
山中,山中,Yamanaka,Unlabeled,2,<b>山中</b>さわ子大先生！,Professor Sawako Yamanaka!,[shincaps] K-ON! Movie (AT-X 1440x1080 MPEG2 AAC),
他,ほか,"1. other (place, thing, person), the rest<br>2. outside, beyond<br>3. nothing except, nothing but, nothing apart from, nothing aside from, no choice (but to)<br>4. besides..., in addition to...",N3,2,皆さん　<b>他</b>にリクエストはないですね,"Everyone, I don't have any other requests.",[shincaps] K-ON! Movie (AT-X 1440x1080 MPEG2 AAC),
物,もの,"1. thing, object, article, stuff, substance<br>2. one's things, possessions, property, belongings<br>3. things, something, anything, everything, nothing<br>4. quality<br>5. reason, the way of things<br>6. used to emphasize emotion, judgment, etc., used to indicate a common occurrence in the past (after a verb in past tense), used to indicate a general tendency, used to indicate something that should happen<br>7. item classified as ..., item related to ..., work in the genre of ...<br>8. cause of ..., cause for ...<br>9. somehow, somewhat, for some reason<br>10. really, truly",N5,2,うん　<b>物</b>でも事でもいいんだけどね,"Yeah, it could be something or something.",[shincaps] K-ON! Movie (AT-X 1440x1080 MPEG2 AAC),
真面目,しんめんもく,"1. one's true character, one's true self, one's true worth<br>2. serious, earnest",N3,2,「もうちょっとだけ<b>真面目</b>に,``Let's be a little more serious'',[shincaps] K-ON! Movie (AT-X 1440x1080 MPEG2 AAC),
ほしい,ほしい,"1. wanted, wished for, in need of, desired<br>2. I want (you) to",Unlabeled,2,練習して<b>ほしい</b>かな」とか,Do you want me to practice?”,[shincaps] K-ON! Movie (AT-X 1440x1080 MPEG2 AAC),
ばっかり,ばかり,"1. only, merely, nothing but, no more than<br>2. approximately, about<br>3. just (finished, etc.)<br>4. as if to, (as though) about to<br>5. indicates emphasis<br>6. always, constantly",Unlabeled,2,世話になって<b>ばっかり</b>だしな,I've always been taken care of.,[shincaps] K-ON! Movie (AT-X 1440x1080 MPEG2 AAC),
だし,だし,"1. parade float, festival float",Unlabeled,2,世話になってばっかり<b>だし</b>な,I've always been taken care of.,[shincaps] K-ON! Movie (AT-X 1440x1080 MPEG2 AAC),
昨日,きのう,1. yesterday,N5,2,<b>昨日</b>　寝る前に,Yesterday before going to bed,[shincaps] K-ON! Movie (AT-X 1440x1080 MPEG2 AAC),
書く,かく,"1. to write, to compose, to pen<br>2. to draw, to paint",N5,2,何か<b>書い</b>てたんですか？,Were you writing something?,[shincaps] K-ON! Movie (AT-X 1440x1080 MPEG2 AAC),
冷たい,つめたい,"1. cold (to the touch), chilly, icy, freezing<br>2. (emotionally) cold, coldhearted, unfeeling, indifferent, unfriendly, distant",N5,2,すごく手が<b>冷たい</b>の,My hands are really cold,[shincaps] K-ON! Movie (AT-X 1440x1080 MPEG2 AAC),
意味,いみ,"1. meaning, significance, sense",N5,2,どういう<b>意味</b>だ,What does it mean?,[shincaps] K-ON! Movie (AT-X 1440x1080 MPEG2 AAC),
ぐらい,くらい,"1. dark, gloomy, murky<br>2. depressed, dispirited, down in the dumps, dark (mood)<br>3. dark (in colour), dull<br>4. ill-boding, dark (e.g. past), suspicious<br>5. unlikely (to succeed), hopeless, unpromising<br>6. unfamiliar (with), ignorant (of)",N1,2,ちょっと<b>ぐらい</b>　いいじゃん　ケチ,It's okay to be a little bit stingy.,[shincaps] K-ON! Movie (AT-X 1440x1080 MPEG2 AAC),
和,ワ,Nodoka,N1,2,<b>和</b>ちゃん　おはよう,Kazu-chan Good morning,[shincaps] K-ON! Movie (AT-X 1440x1080 MPEG2 AAC),
あら,あら,"1. oh, ah",N1,2,<b>あら</b>　おはよう,"Oh, good morning",[shincaps] K-ON! Movie (AT-X 1440x1080 MPEG2 AAC),
申し込み,もうしこみ,"1. application, entry, request, subscription, offer, proposal, overture, challenge",N1,2,旅行会社へ<b>申し込み</b>に行くんだよ,I'm going to apply at a travel agency.,[shincaps] K-ON! Movie (AT-X 1440x1080 MPEG2 AAC),
買い,かい,"1. buying, shopping<br>2. buyer<br>3. purchase",Unlabeled,2,水着　<b>買い</b>に行こう,Let's go buy a swimsuit,[shincaps] K-ON! Movie (AT-X 1440x1080 MPEG2 AAC),
初めて,はじめて,"1. for the first time<br>2. only after ... is it ..., only when ... do you ...",N5,2,私が<b>初めて</b>,my first time,[shincaps] K-ON! Movie (AT-X 1440x1080 MPEG2 AAC),
どっ,どちら,"1. which way, which direction, where<br>2. which one (esp. of two alternatives)<br>3. who",Unlabeled,2,<b>どっ</b>かで聞いたことある名前だね,It's a name I've heard somewhere before.,[shincaps] K-ON! Movie (AT-X 1440x1080 MPEG2 AAC),
卒業式,そつぎょうしき,"1. graduation ceremony, commencement",Unlabeled,2,<b>卒業式</b>の日にクラス全員で,The whole class on graduation day,[shincaps] K-ON! Movie (AT-X 1440x1080 MPEG2 AAC),
ぜひ,ぜひ,"1. certainly, without fail<br>2. right and wrong, pros and cons",N4,2,ここは　<b>ぜひ</b>私達も,We would love to have you here too.,[shincaps] K-ON! Movie (AT-X 1440x1080 MPEG2 AAC),
ふん,ふん,"1. minute (unit of time)<br>2. fun (one tenth of a monme, 5.787 grains)",Unlabeled,2,<b>ふん</b>ふん　ってダーメ！,"Hmph, no good!",[shincaps] K-ON! Movie (AT-X 1440x1080 MPEG2 AAC),
ダーメ,ダーメ,1. Dame (Auto-translated),Unlabeled,2,ふんふん　って<b>ダーメ</b>！,"Hmph, no good!",[shincaps] K-ON! Movie (AT-X 1440x1080 MPEG2 AAC),
よそ,よそ,"1. another place, somewhere else, strange parts<br>2. outside (one's family or group), someone else, other people<br>3. not caring for, being indifferent to, taking little notice of, ignoring, neglecting",Unlabeled,2,<b>よそ</b>はよそ　うちはうち,"Outside is outside, inside is inside",[shincaps] K-ON! Movie (AT-X 1440x1080 MPEG2 AAC),
うち,うち,"1. house<br>2. one's house, one's home, one's family, one's household",N4,2,よそはよそ　<b>うち</b>はうち,"Outside is outside, inside is inside",[shincaps] K-ON! Movie (AT-X 1440x1080 MPEG2 AAC),
より,より,"1. than<br>2. from, out of, since, at, on<br>3. except, but, other than<br>4. more",N5,2,それ<b>より</b>も　梓に何がしてやれるか,What can I do for Azusa instead?,[shincaps] K-ON! Movie (AT-X 1440x1080 MPEG2 AAC),
もちろん,もちろん,"1. of course, certainly, naturally",N4,2,これ　<b>もちろん</b>先生には内緒で,"This, of course, is a secret from the teacher.",[shincaps] K-ON! Movie (AT-X 1440x1080 MPEG2 AAC),
教科書,きょうかしょ,"1. textbook, coursebook, schoolbook",N3,2,♬～歴史の<b>教科書</b>　表紙の表紙より,♬～From the cover of the history textbook,[shincaps] K-ON! Movie (AT-X 1440x1080 MPEG2 AAC),
年,とし,"1. year<br>2. age, years<br>3. past one's prime, old age",N5,2,私達がもう１<b>年</b>　学校にいて,We've been in school for another year,[shincaps] K-ON! Movie (AT-X 1440x1080 MPEG2 AAC),
んと,うんと,"1. a great deal, very much, a lot<br>2. with a great amount of effort",Unlabeled,2,あずにゃ<b>んと</b>一緒に卒業できると,I hope I can graduate with Azu-nyan.,[shincaps] K-ON! Movie (AT-X 1440x1080 MPEG2 AAC),
空耳,そらみみ,1. mishearing<br>2. (feigned) deafness<br>3. homophonic translation of song lyrics for comic effect,Unlabeled,2,♬～<b>空耳</b>　たぶん空耳　空の耳～,"♬~Sora-mimi, probably sky-ears, sky-ears~",[shincaps] K-ON! Movie (AT-X 1440x1080 MPEG2 AAC),
相談,そうだん,"1. consultation, discussion, discussing, asking (somebody) for advice",N4,2,どこに行くかを<b>相談</b>してたの,We were talking about where to go,[shincaps] K-ON! Movie (AT-X 1440x1080 MPEG2 AAC),
都市,とし,"1. town, city, municipal, urban",N3,2,リューネンって<b>都市</b>があって,There's a city called Lünen.,[shincaps] K-ON! Movie (AT-X 1440x1080 MPEG2 AAC),
ミュージシャン,ミュージシャン,1. musician,Unlabeled,2,もし偶然　誰か<b>ミュージシャン</b>に,If someone happens to be a musician,[shincaps] K-ON! Movie (AT-X 1440x1080 MPEG2 AAC),
歴史,れきし,1. history,N4,2,音楽の<b>歴史</b>もあるし,There is also a history of music.,[shincaps] K-ON! Movie (AT-X 1440x1080 MPEG2 AAC),
バラバラ,バラバラ,"1. scattered, disperse, loose, disconnected, in pieces, in drops, rustling",Unlabeled,2,<b>バラバラ</b>ですね,It's falling apart,[shincaps] K-ON! Movie (AT-X 1440x1080 MPEG2 AAC),
あみだくじ,あみだくじ,"1. ghostleg lottery, ladder lottery, lottery in which participants trace a line across a lattice pattern to determine the winner",Unlabeled,2,<b>あみだくじ</b>で行くとこ決めよう,Let's decide where to go using the Amidakuji lottery.,[shincaps] K-ON! Movie (AT-X 1440x1080 MPEG2 AAC),
タイプ,タイプ,"1. type, kind, sort, style<br>2. type (of person), (ideal) type, one's type<br>3. typewriter<br>4. typing",N4,2,あみだくじは得意な<b>タイプ</b>だよ,Amidakuji is my favorite type.,[shincaps] K-ON! Movie (AT-X 1440x1080 MPEG2 AAC),
